nvidia,Ozbargain.com.au,Alice09,"80% off Mini HDMI to HDMI Adapter $1.8, 35% off Mini HDMI to HDMI Cable 1M $9.09 + Delivery ($0 Prime) @ CableCreation Amazon AU","1.CableCreation Mini HDMI to HDMI Cable 3.3FT, High Speed 4Kx2K HDMI to Mini 4K HDMI Cable & Cable Tie, Compatible with Camera,Graphics/Video Card Camcorder,Laptop,HDTV, Raspberry Pi Zero W



Original Price: $13.99



Now Price: $9.09



Discount: 35% off

Link: ht…","1.CableCreation Mini HDMI to HDMI Cable 3.3FT, High Speed 4Kx2K HDMI to Mini 4K HDMI Cable &amp; Cable Tie, Compatible with Camera,Graphics/Video Card Camcorder,Laptop,HDTV, Raspberry Pi Zero W

Orig… [+2281 chars]",https://www.ozbargain.com.au/node/689590,https://files.ozbargain.com.au/n/90/689590x.jpg?h=98d1895b,2022-03-19 10:08:23.000000,2022-03-21 16:48:20.063158
nvidia,Thewindowsclub.com,KomalSrivastava@TWC,Fix Elden Ring FPS Drops and Stuttering issues on Windows PC,"Are you facing FPS drops and stutters with the Elden Ring game? Here is a complete guide to fix FPS drops and stuttering issues on Elden Ring on Windows 11/10 PC. There can be multiple reasons that can cause the problem at hand. Now, if you are also experienc…",Are you facing FPS drops and stutters with the Elden Ring game? Here is a complete guide to fix FPS drops and stuttering issues on Elden Ring on Windows 11/10 PC. There can be multiple reasons that c… [+8855 chars],https://www.thewindowsclub.com/elden-ring-fps-drops-and-stuttering-issues,https://www.thewindowsclub.com/wp-content/uploads/2022/03/Fix-Elden-Ring-FPS-Drops-and-Stuttering-Issue.png,2022-03-19 17:48:08.000000,2022-03-21 16:48:20.063158
nvidia,Cgpersia.com,Diptra,V-Ray 5.20.05 for SketchUp 2017-2022 Win x64,"V-Ray 5.20.05 for SketchUp 2017-2022 Win x64 Title: V-Ray 5.20.05 for SketchUp 2017-2022 Win x64 Info: With V-Ray Next for SketchUp we’ve boosted the speed and simplicity of SketchUp’s premier renderer. Now, with a few clicks, you can create high-quality ray-…","V-Ray 5.20.05 for SketchUp 2017-2022 Win x64

Info:With V-Ray Next for SketchUp weve boosted the speed and simplicity of SketchUps premier renderer. Now, with a few clicks, you can create high-qualit… [+2295 chars]",https://cgpersia.com/2022/03/v-ray-5-20-05-for-sketchup-2017-2022-win-x64-183247.html,,2022-03-19 17:11:11.000000,2022-03-21 16:48:20.063158
nvidia,Wccftech,Usman Pirzada,Rumor: AMD’s MCM Based RDNA3 RX 7000 GPUs Will Be More Power Efficient Than NVIDIA RTX 4000 GPUs And Could Even Offer Higher Performance,"An analysis by Moores Law is Dead (via HardwareTimes) suggests that AMD""s next-generation RTX 7000 series (which have been confirmed to be based on the MCM approach) could out-perform NVIDIA""s RTX 4000 series GPUs. It goes without saying that this is a huge r…","An analysis by Moores Law is Dead (via HardwareTimes) suggests that AMD""s next-generation RTX 7000 series (which have been confirmed to be based on the MCM approach) could out-perform NVIDIA""s RTX 40… [+3869 chars]",https://wccftech.com/rumor-amds-mcm-based-rdna3-rx-7000-gpus-will-be-more-power-efficient-than-nvidia-rtx-4000-gpus-and-could-even-offer-higher-performance/,https://cdn.wccftech.com/wp-content/uploads/2015/05/nvidia-vs-AMD-1.jpg,2022-03-19 23:27:16.000000,2022-03-21 16:48:20.063158
nvidia,Slashdot.org,EditorDavid,"More Apple M1 Ultra Benchmarks Show It Doesn""t Beat the Best GPUs from Nvidia and AMD","Tom""s Guide tested a Mac Studio workstation equipped with an M1 Ultra with the Geekbench 5.4 CPU benchmarks ""to get a sense of how effectively it handles single-core and multi-core workflows."" 



""Since our M1 Ultra is the best you can buy (at a rough price of…","Tom""s Guide tested a Mac Studio workstation equipped with an M1 Ultra with the Geekbench 5.4 CPU benchmarks ""to get a sense of how effectively it handles single-core and multi-core workflows.""""Since … [+3315 chars]",https://hardware.slashdot.org/story/22/03/19/2031214/more-apple-m1-ultra-benchmarks-show-it-doesnt-beat-the-best-gpus-from-nvidia-and-amd,https://a.fsdn.com/sd/topics/graphics_64.png,2022-03-20 01:34:00.000000,2022-03-21 16:48:20.067717
nvidia,DIYphotography,John Aldred,New Google Chrome extension helps you spot fake photos with 99.29% accuracy,"With the rise in AI-generated imagery lately, creating fake images, even very realistic looking human faces is become more widespread and readily available than ever – especially thanks to services like This Person Does Not Exist – which uses NVIDIA tech that…","With the rise in AI-generated imagery lately, creating fake images, even very realistic looking human faces is become more widespread and readily available than ever especially thanks to services lik… [+2058 chars]",https://www.diyphotography.net/new-google-chrome-extension-helps-you-spot-fake-photos-with-99-29-accuracy/,https://www.diyphotography.net/wp-content/uploads/2022/03/real-or-fake.jpg,2022-03-20 17:53:10.000000,2022-03-21 16:48:20.067717
nvidia,Yahoo Entertainment,Alan Farley,Take Aggressive NVIDIA Profits,"The chip giant posted outstanding gains last week, lifting more than 25% to a four-week high.","NVIDIA Corp. (NVDA) posted outstanding gains last week, lifting more than 25% to a four-week high. The turnaround erupted at the 200-day moving average, raising hopes for a sustained bottom and end o… [+2441 chars]",https://finance.yahoo.com/news/aggressive-nvidia-profits-123803446.html,https://s.yimg.com/uu/api/res/1.2/E2QzVwMH5qsl3y_.4i8Eww--~B/aD00MTA7dz02MTU7YXBwaWQ9eXRhY2h5b24-/https://media.zenfs.com/en/fx_empire_176/174370bc9041e041d0fc57559bd65270,2022-03-20 12:38:03.000000,2022-03-21 16:48:20.067717
nvidia,Justcreative.com,Jacob Cass,15+ Best Desktop Computers for Video Editing in 2022,"Looking for the best computer for video editing? Look no further. Today, we look at the best video editing computers, for all budget ranges and skill levels.","Looking for the best computer for video editing? This buying guide will help you choose the right one for your video editing needs whether that be motion graphics, animation or stop motion.

Today, w… [+30356 chars]",https://justcreative.com/best-video-editing-computers/,https://justcreative.com/wp-content/uploads/2019/06/best-video-editing-computers.jpg,2022-03-20 03:48:32.000000,2022-03-21 16:48:20.067717
nvidia,Motley Fool,newsfeedback@fool.com (Travis Hoium),Just One More Reason to Be Bullish on Apple Stock,"Apple""s latest development gives it even greater competitive advantage.","The news of Apple""s ( AAPL 2.09% ) latest development could cause considerable industry disruption. In this clip from ""The Virtual Opportunities Show"" on Motley Fool Live, recorded on March 15, Motle… [+2701 chars]",https://www.fool.com/investing/2022/03/20/just-one-more-reason-to-be-bullish-on-apple-stock/,https://g.foolcdn.com/editorial/images/671177/gettyimages-1319763415.jpg,2022-03-20 12:00:00.000000,2022-03-21 16:48:20.067717
nvidia,XDA Developers,Karthik Iyer,AMD Ryzen 9 6900HX Review: Can Ryzen 6000 series CPU beat Intel Alder Lake?,"Intel created huge waves in the industry with the launch of its 12th-gen Alder Lake CPUs, but AMD isn’t giving up just yet. The AMD Ryzen 6900HX represents the best of what AMD has to offer in terms of the performance with new Ryzen 6000 series chips. This 45…","Intel created huge waves in the industry with the launch of its 12th-gen Alder Lake CPUs, but AMD isn’t giving up just yet. The AMD Ryzen 6900HX represents the best of what AMD has to offer in terms … [+17952 chars]",https://www.xda-developers.com/asus-rog-strix-g15-review/,https://www.xda-developers.com/files/2022/03/ASUS-ROG-Strix-G15-2022-featured-1.jpg,2022-03-20 15:00:54.000000,2022-03-21 16:48:20.067717
nvidia,Neowin,work@buria.me (Taras Buria),"Two years after Chrome and Edge, Firefox is getting AV1 hardware acceleration","In 2020, Microsoft and Google equipped their browsers with hardware acceleration for the AV1 video support. Two years later, Mozilla is finally catching up with the same capability in Firefox. Read more...","According to an update made to a post on Bugzilla, The Mozilla Foundation is finally ready to add hardware acceleration for the AV1 video format. Developers plan to implement improved AV1 support in … [+1751 chars]",https://www.neowin.net/news/two-years-after-chrome-and-edge-firefox-is-getting-av1-hardware-acceleration/,https://cdn.neow.in/news/images/uploaded/2022/03/1647772028_firefox_av1_story.jpg,2022-03-20 11:38:01.000000,2022-03-21 16:48:20.067717
nvidia,Neowin,sen92sayan@gmail.com (Sayan Sen),Here are the best graphics cards for 1080p gaming in 2022 (Part 1),"As GPU prices begin to settle slowly creeping back to their MSRP levels, we look at the best graphics card purchases to make across a wide variety of refresh rates for those that game at 1080p. Read more...","For the longest time, it has been near impossible to purchase graphics cards at fair market prices. A variety of factors like the global chip shortage, cryptocurrency mining, among others, has contri… [+5212 chars]",https://www.neowin.net/news/here-are-the-best-graphics-cards-for-1080p-gaming-in-2022-part-1/,https://cdn.neow.in/news/images/uploaded/2022/03/1647696996_msi_graphics_cards_2_story.jpg,2022-03-20 16:32:01.000000,2022-03-21 16:48:20.067717
nvidia,SamMobile,Asif S.,Samsung’s Chromebooks could soon support variable refresh rates,"A few days ago, Google announced support for Steam on ChromeOS. It’s the most popular game distribution platform for PC games, and it’s now coming to ChromeOS devices, albeit in a beta form for now. In line with that announcement, Google appears to be working…","A few days ago, Google announced support for Steam on ChromeOS. It’s the most popular game distribution platform for PC games, and it’s now coming to ChromeOS devices, albeit in a beta form for now. … [+1459 chars]",https://www.sammobile.com/news/samsung-chromebooks-support-variable-refresh-rates/,https://www.sammobile.com/wp-content/uploads/2021/02/Samsung-Galaxy-Chromebook-Fiesta-Red.jpg-720x405.png,2022-03-20 11:18:00.000000,2022-03-21 16:48:20.067717
nvidia,Gizchina.com,Marco Lancaster,Nvidia MX570 to boast the same video codec as RXT 2050,"NVIDIA has just unveiled the NVIDIA MX150, 250, 350, 450 four-generation MX series graphics cards, all without NVENC / NVDEC video codec units. The info ...

The post Nvidia MX570 to boast the same video codec as RXT 2050 appeared first on Gizchina.com.","NVIDIA has just unveiled the NVIDIA MX150, 250, 350, 450 four-generation MX series graphics cards, all without NVENC / NVDEC video codec units. The info comes straight from industry insiders “Golden … [+2483 chars]",https://www.gizchina.com/2022/03/20/nvidia-mx570-to-boast-the-same-video-codec-as-rxt-2050/,https://www.gizchina.com/wp-content/uploads/images/2022/03/imagem_2022-03-20_170513.png,2022-03-20 20:06:16.000000,2022-03-21 16:48:20.067717
nvidia,Ozbargain.com.au,danm02,"Lenovo Legion 5i Gen 6 (i7-11600H, RTX 3060 6GB, 15.6"" WQHD 165Hz, 16GB RAM, 512GB SDD) $1799.20 Delivered @ Lenovo eBay","Specifications



Battery: Integrated 80Wh

Bluetooth: Bluetooth® 5.0 or above

Display: 15.6"" WQHD (2560x1440) IPS 300nits Anti-glare, 165Hz, 100% sRGB, Dolby Vision, G-Sync, DC dimmer

Finger Print Reader: No Fingerprint Reader

Graphics: NVIDIA® GeForce RTX™ 306…","Specifications

Battery: Integrated 80WhBluetooth: Bluetooth® 5.0 or aboveDisplay: 15.6"" WQHD (2560x1440) IPS 300nits Anti-glare, 165Hz, 100% sRGB, Dolby Vision, G-Sync, DC dimmerFinger Print Reader:… [+403 chars]",https://www.ozbargain.com.au/node/689775,https://files.ozbargain.com.au/n/75/689775.jpg?h=969201dc,2022-03-20 13:19:39.000000,2022-03-21 16:48:20.067717
nvidia,Levelup.com,Ulises Contreras,"Empleados de almacén ruso roban casi $38,000 USD en tarjetas gráficas","Editorial: Gaming / Facebook / Twitter / YouTube / Instagram / Noticias / Discord / Foros / Telegram / WhatsApp

Continuar leyendo »","Editorial: Gaming / Facebook / Twitter / YouTube / Instagram / Noticias / Discord / Foros / Telegram / WhatsApp

En protesta contra la actual invasión a Ucrania, AMD y NVIDIA dejaron de enviar sus pr… [+1940 chars]",https://www.levelup.com/noticias/667270/Empleados-de-almacen-ruso-roban-casi-38000-USD-en-tarjetas-graficas,https://cl.buscafs.com/www.levelup.com/public/uploads/images/732709/732709_600x315.jpg,2022-03-20 17:32:00.000000,2022-03-21 16:48:20.067717
nvidia,TweakTown,Anthony Garreffa,Russian warehouse staffers busted in GPU heist: 20 x RTX 3070 Ti cards,"Warehouse workers at Russian company ""Wildberries"" tried to steal up to 20 x GeForce RTX 3070 Ti cards, busted in GPU heist. Continue reading at TweakTown >","Uh, so there are some warehouse workers that are in some serious trouble: staffers at Russian company ""Wildberries"" tried to steal 20 x GeForce RTX 3070 Ti graphics cards... but they were busted.

Li… [+815 chars]",https://www.tweaktown.com/news/85166/russian-warehouse-staffers-busted-in-gpu-heist-20-rtx-3070-ti-cards/index.html,https://static.tweaktown.com/news/8/5/85166_01_russian-warehouse-staffers-busted-in-gpu-heist-20-rtx-3070-ti-cards_full.jpg,2022-03-20 23:26:20.000000,2022-03-21 16:48:20.067717
nvidia,Ozbargain.com.au,taimou,Foxtel Go Ultimate $49p/m for 12 months and Foxtel Go Box for $29 from Koogan (plus shipping unless you have Koogan first),"Toofa on currently, not sure if it""s just Foxtel in it""s death throws but currently really good value (for Foxtel at least)



For me Iv""e missed the History channel bad since I kicked Foxtel to the curb years ago, plus it""s Footy season!!!!



Foxtel Go streamin…","Toofa on currently, not sure if it""s just Foxtel in it""s death throws but currently really good value (for Foxtel at least)

For me Iv""e missed the History channel bad since I kicked Foxtel to the cu… [+1343 chars]",https://www.ozbargain.com.au/node/689758,https://files.ozbargain.com.au/n/58/689758l.jpg?h=572f4de5,2022-03-20 11:17:19.000000,2022-03-21 16:48:20.067717
nvidia,Hotukdeals.com,Frank30uk,119° - HP Omen (Core i5-11400F / 16GB Ram / 256GB SSD / GTX 3060) £864.96 - £789.96 with code (Select accounts) @ buyitdirectdiscounts / Ebay,"Credit to <a href=""https://www.hotukdeals.com/profile/sisqoboy"" target=""_blank"">@sisqoboy</a> for the initial find. Discovered you can now order it for under £800 using the code <strong>VIP20</strong> at checkout.<br /><br />Power and performance for a premiu…","Credit to @sisqoboy for the initial find. Discovered you can now order it for under £800 using the code VIP20 at checkout.Power and performance for a premium entertainment, gaming and multitasking ex… [+2355 chars]",https://www.hotukdeals.com/deals/hp-omen-gt12-1011na-pc-core-i5-11400f-16gb-ram-256gb-ssd-2tb-hdd-rtx-3060-win10-ps78996-with-code-at-buyitdirectdiscounts-ebay-3907463,https://images.hotukdeals.com/threads/raw/5E7ss/3907463_1/re/1024x1024/qt/60/3907463_1.jpg,2022-03-20 18:56:08.000000,2022-03-21 16:48:20.067717
nvidia,Wccftech,Alessio Palumbo,Overwatch 2 Closed Beta Begins on April 26th; Early PC Specs Unveiled,"The Overwatch 2 Closed Beta is officially set to begin on April 26th, Blizzard Entertainment revealed on Friday. The developers have also confirmed additional details, such as the requirement to own the first game to be eligible for the first Closed Beta even…","The Overwatch 2 Closed Beta is officially set to begin on April 26th, Blizzard Entertainment revealed on Friday. The developers have also confirmed additional details, such as the requirement to own … [+2116 chars]",https://wccftech.com/overwatch-2-closed-beta-begins-on-april-26th-early-pc-specs-unveiled/,https://cdn.wccftech.com/wp-content/uploads/2022/03/overwatch_2_beta-HD-scaled.jpg,2022-03-20 12:53:28.000000,2022-03-21 16:48:20.067717
nvidia,Next Big Future,Brian Wang,Car Chip Shortage to 2024 and Tesla Mostly Immune,"I, Brian Wang, have researched the car chip shortage. Many people have said that the car chip shortage will clear up by the second half of 2022 but they are wrong. The car chip shortage will last...



[[ This is a content summary only. Visit my website for ful…","I, Brian Wang, have researched the car chip shortage. Many people have said that the car chip shortage will clear up by the second half of 2022 but they are wrong. The car chip shortage will last unt… [+5122 chars]",https://www.nextbigfuture.com/2022/03/car-chip-shortage-to-2024-and-tesla-mostly-immune.html,https://nextbigfuture.s3.amazonaws.com/uploads/2022/03/carchips.jpeg,2022-03-20 01:44:49.000000,2022-03-21 16:48:20.067717
nvidia,Seeking Alpha,Wall Street Breakfast,Wall Street Breakfast: The Week Ahead,"Listen on the go! A daily podcast of Wall Street Breakfast will be available by 8:00 a.m. on Seeking Alpha, iTunes, Stitcher and Spotify.","Listen on the go! A daily podcast of Wall Street Breakfast will be available by 8:00 a.m. on Seeking Alpha, iTunes, Stitcher and Spotify.

Economic reports in the week ahead

 A couple of crucial rea… [+6113 chars]",https://seekingalpha.com/article/4496658-wall-street-breakfast-week-ahead,https://static.seekingalpha.com/assets/og_image_1200-29b2bfe1a595477db6826bd2126c63ac2091efb7ec76347a8e7f81ba17e3de6c.png,2022-03-20 10:35:15.000000,2022-03-21 16:48:20.067717
nvidia,Nationalcybersecurity.com,Angela Dennis,Lapsus$ hack leaves NVIDIA in a tight spot | #cybersecurity | #cyberattack | #cybersecurity | #infosecurity | #hacker,World Largest Source Of Security News.,"According to an IBM report, ransomware was the top attack type (again) in 2021. Recently, NVIDIA confirmed the hack attack that compromised their internal systems. The infamous hacker group Lapsus$ c… [+3614 chars]",https://nationalcybersecurity.com/lapsus-hack-leaves-nvidia-in-a-tight-spot-cybersecurity-cyberattack-cybersecurity-infosecurity-hacker/,https://nationalcybersecurity.com/wp-content/uploads/lap-b_11zon.jpg,2022-03-20 08:01:00.000000,2022-03-21 16:48:20.067717
nvidia,Yahoo Entertainment,Jose Karlo Mari Tottoc,10 Cheap Stocks Hedge Funds Are Talking About,"In this article, we discuss 10 cheap stocks hedge funds are talking about. You can skip our comprehensive analysis of the financial markets today and go...","In this article, we discuss 10 cheap stocks hedge funds are talking about. You can skip our comprehensive analysis of the financial markets today and go directly to 5 Cheap Stocks Hedge Funds Are Tal… [+13099 chars]",https://finance.yahoo.com/news/10-cheap-stocks-hedge-funds-141946036.html,https://s.yimg.com/uu/api/res/1.2/xWFJUoUWT8NizlK99j4iVw--~B/aD00OTY7dz03NTA7YXBwaWQ9eXRhY2h5b24-/https://media.zenfs.com/en/insidermonkey.com/5b979a94d337796b122d3138bb983a21,2022-03-20 14:19:46.000000,2022-03-21 16:48:20.067717
nvidia,Wmleader.com,Raymond Hicks,GTC 2022: GPU topics go beyond tech prowess and applications - The Madison Leader Gazette,"<ol><li>GTC 2022: GPU topics go beyond tech prowess and applications  The Madison Leader Gazette

</li><li>NVIDIA Hopper GPU Architecture and H100 Accelerator Announced: Working Smarter and Harder  AnandTech

</li><li>Nvidia reveals H100 GPU for AI and teases…","Did you miss a session at the Data Summit? Watch On-Demand Here.

When Nvidias GTC conference kicks off this week, the sessions will be filled with some of the typical discussions on technical topics… [+5678 chars]",https://wmleader.com/technology/385222/gtc-2022-gpu-topics-go-beyond-tech-prowess-and-applications/,,2022-03-21 19:39:51.000000,2022-03-27 12:06:26.368559
nvidia,Digital Trends,Zak Islam,AMD’s next superefficient GPUs could have Nvidia worried,"A new rumor from well-known tech insider Moore""s Law Is Dead outlines the technical differences between Team Red’s RTX 7000 cards and Nvidia’s RTX 4000-series.","Given the performance upgrades weve seen in recent years in regard to graphics cards, the battle between AMD and Nvidias upcoming next-gen GPUs is shaping up to be one of the most exciting times in t… [+4355 chars]",https://www.digitaltrends.com/computing/amds-next-superefficient-gpus-could-have-nvidia-worried/,https://icdn.digitaltrends.com/image/digitaltrends/amd-radeon-rx-6500-xt-review-01.jpg,2022-03-21 15:52:47.000000,2022-03-27 12:06:26.368559
nvidia,Vice News,"Joseph Cox, Emanuel Maiberg",Microsoft Investigating Claim of Breach by Extortion Gang,The LAPSUS$ group has previously compromised Nvidia and Samsung. Over the weekend the group published a screenshot that appeared to show access to internal Microsoft systems.,"Microsoft is investigating claims that an extortion-focused hacking group that has previously compromised massive companies such as Ubisoft and Nvidia has gained access to internal Microsoft systems,… [+4448 chars]",https://www.vice.com/en/article/y3vk9x/microsoft-hacked-lapsus-extortion-investigating,https://video-images.vice.com/articles/62386e3812f2c5009b208440/lede/1647865413606-microsoft.jpeg?image-resize-opts=Y3JvcD0xeHc6MC44NDI4eGg7MHh3LDB4aCZyZXNpemU9MTIwMDoqJnJlc2l6ZT0xMjAwOio,2022-03-21 12:36:47.000000,2022-03-27 12:06:26.368559
nvidia,Slashdot.org,BeauHD,Microsoft Investigating Claims of Hacked Source Code Repositories,"Microsoft says they are investigating claims that the Lapsus$ data extortion hacking group breached their internal Azure DevOps source code repositories and stolen data. BleepingComputer reports: Unlike many extortion groups we read about today, Lapsus$ does …","Unlike many extortion groups we read about today, Lapsus$ does not deploy ransomware on their victim""s devices. Instead, they target the source code repositories for large companies, steal their prop… [+1460 chars]",https://it.slashdot.org/story/22/03/21/2154227/microsoft-investigating-claims-of-hacked-source-code-repositories,https://a.fsdn.com/sd/topics/microsoft_64100.png,2022-03-21 22:40:00.000000,2022-03-27 12:06:26.368559
nvidia,Android Central,Derrek Lee,"Apple TV app gets downgraded on Android TV, won""t let users buy or rent movies",Android TV users complain that they can no longer rent or buy movies and shows from the Apple TV app following a recent update.,<ul><li>The Apple TV app on Android TV has apparently stopped allowing in-app transactions.</li><li>Users have noticed that they can no longer rent or buy movies and shows through the Apple TV app.</… [+2455 chars],https://www.androidcentral.com/apple-tv-android-tv-in-app-purchases,https://cdn.mos.cms.futurecdn.net/DvAmPHwuCCeA7BLXg9RWMY-1200-80.jpg,2022-03-21 18:23:59.000000,2022-03-27 12:06:26.368559
nvidia,Windows Central,Sean Endicott,Hacking group that went after NVIDIA may have also attacked Microsoft,"Microsoft is looking into claims that Lapsus$ has gained access to the company""s internal systems.







What you need to know





Hacking group Lapsus$ claims that it has gained access to Microsoft""s internal systems, according to a recent report.

Lapsus$ often s…","Well-known hacking group Lapsus$ claimed that it gained access to Microsoft""s internal systems, according to a report by Motherboard. Lapsus$ has stolen data from NVIDIA, Samsung, and other companies… [+1388 chars]",https://www.windowscentral.com/microsoft-may-have-been-hit-same-hackers-who-went-after-nvidia,https://www.windowscentral.com/sites/wpcentral.com/files/styles/large/public/field/image/2022/01/microsoft-logo-2022-2.jpg,2022-03-21 13:58:41.000000,2022-03-27 12:06:26.368559
nvidia,VentureBeat,Peter Wayner,GTC 2020: GPU topics go beyond tech prowess and applications,"GPUs were once only noticed by gamers and AI scientists, but they are now key components in many of the most essential parts of the economy. GPUs are the highest-profile circuits sold at the highest prices and are of flagship for the entire industry. When the…","Did you miss a session at the Data Summit? Watch On-Demand Here.

When Nvidias GTC conference kicks off this week, the sessions will be filled with some of the typical discussions on technical topics… [+5678 chars]",https://venturebeat.com/2022/03/21/gtc-2020-gpu-topics-go-beyond-tech-prowess-and-applications/,https://venturebeat.com/wp-content/uploads/2022/03/GPU_circuit_board.jpg?w=1200&strip=all,2022-03-21 10:30:00.000000,2022-03-27 12:06:26.368559
nvidia,9to5Mac,Ben Lovejoy,Apple TV app on Android and Google TV now blocks movie rentals and purchases,"The Apple TV app on both Android TV and Google TV no longer offers the option to buy or rent movies, while Apple TV+ subscriptions can still be purchased.

It’s being suggested that the change may have been made to avoid Google’s 30% commission on sales throug…","The Apple TV app on both Android TV and Google TV no longer offers the option to buy or rent movies, while Apple TV+ subscriptions can still be purchased.

It’s being suggested that the change may ha… [+1694 chars]",https://9to5mac.com/2022/03/21/apple-tv-app-on-android-blocks-sales/,https://i0.wp.com/9to5mac.com/wp-content/uploads/sites/6/2022/03/Apple-TV-app-on-Android-TV.jpg?resize=1200%2C628&quality=82&strip=all&ssl=1,2022-03-21 12:08:30.000000,2022-03-27 12:06:26.368559
nvidia,Windows Central,Sean Endicott,LG’s fancy new gram laptops are only available in Korea,"LG""s new gram laptops are faster than ever, but you""ll have to wait to get one if you""re outside of South Korea.



2021 model of the LG gram 17.



What you need to know





LG just announced refreshes of its gram 16 and 17 laptops.

The new LG gram 16 and 17 run o…",LG just announced new versions of its gram 16 and gram 17 laptops. The devices feature 12th Gen Intel Core processors and optional NVIDIA RTX 2050 graphics. LG promises 70% speed improvements over th… [+1349 chars],https://www.windowscentral.com/lg-announces-new-gram-laptops-12th-gen-intel-cpus-and-nvidia-rtx-2050-graphics,https://www.windowscentral.com/sites/wpcentral.com/files/styles/large/public/field/image/2021/03/lg-gram-17-2021-1.jpg,2022-03-21 16:44:50.000000,2022-03-27 12:06:26.368559
