nvidia,CNET,Attila Tomaschek,Arm Turns to Layoffs After Nvidia Deal Falls Through - CNET,"The chipmaker could be cutting nearly 1,000 jobs in the US and UK.","Arm""s layoffs could affect close to 1,000 employees in the US and UK.

Arm; Illustration by Stephen Shankland/CNET

Chipmaker Arm, owned by Japanese tech giant SoftBank, is making plans for layoffs a… [+812 chars]",https://www.cnet.com/tech/computing/arm-turns-to-layoffs-after-nvidia-deal-falls-through/,https://www.cnet.com/a/img/resize/08d20a65b2743620a4e640e17704a9cfd831ec04/2021/05/25/e27405fa-f6b3-4069-97c0-0367bf76f704/arm-cortex-x2-gradient.jpg?auto=webp&fit=crop&height=630&width=1200,2022-03-15 14:09:00.000000,2022-03-21 16:48:12.750188
nvidia,The Guardian,Guardian staff and agency,"UK chipmaker Arm to cut up to 1,000 jobs after $40bn sale collapses","Company says most of redundancies will be in UK and US after Nvidia takeover falls throughArm is planning to cut up to 15% of its workforce, the UK computer chipmaker said on Monday, just over a month after the collapse of the firm’s $40bn (£30bn) sale to its…","Arm is planning to cut up to 15% of its workforce, the UK computer chipmaker said on Monday, just over a month after the collapse of the firms $40bn (£30bn) sale to its US rival Nvidia.

The Cambridg… [+1935 chars]",https://amp.theguardian.com/business/2022/mar/15/uk-chipmaker-arm-cut-jobs-sale-uk-us-nvidia,https://i.guim.co.uk/img/media/53a75422501b0fae23bbc4b9b7c5d4a706f39228/0_331_3500_2100/master/3500.jpg?width=1200&height=630&quality=85&auto=format&fit=crop&overlay-align=bottom%2Cleft&overlay-width=100p&overlay-base64=L2ltZy9zdGF0aWMvb3ZlcmxheXMvdGctZGVmYXVsdC5wbmc&enable=upscale&s=581777fb3b6498f61e13c5cb35f2ddb4,2022-03-15 07:56:12.000000,2022-03-21 16:48:12.750188
nvidia,Ars Technica,Scharon Harding,Microsoft promises faster PC game load times with DirectStorage release,"Developers will be able to create more detailed virtual worlds, Microsoft says.","Enlarge/ You""ll need an NVMe SSD to use DirectStorage on Windows.

10 with 8 posters participating

PC games can now use DirectStorage, a DirectX 12 Ultimate API that Microsoft announced in 2020. The… [+1872 chars]",https://arstechnica.com/gaming/2022/03/microsoft-promises-faster-pc-game-load-times-with-directstorage-release/,https://cdn.arstechnica.net/wp-content/uploads/2022/03/GettyImages-1166311282-760x380.jpg,2022-03-15 16:21:54.000000,2022-03-21 16:48:12.750188
nvidia,Reuters,,Futures edge higher ahead of Fed meeting - Reuters.com,"U.S. stock index futures edged higher on Tuesday ahead of the Federal Reserve""s two-day policy meeting, with investors also assessing the fallout from fresh COVID-19 restrictions in China.","March 15 (Reuters) - U.S. stock index futures edged higher on Tuesday ahead of the Federal Reserve""s two-day policy meeting, with investors also assessing the fallout from fresh COVID-19 restrictions… [+2016 chars]",https://www.reuters.com/business/futures-edge-higher-ahead-fed-meeting-2022-03-15/,https://www.reuters.com/resizer/aJVSl3ILzWYmWq_Zlcd9g9nreYU=/1200x628/smart/filters:quality(80)/cloudfront-us-east-2.images.arcpublishing.com/reuters/DM65WCYQRJLYZI2XLXN3ETLGYA.jpg,2022-03-15 11:25:00.000000,2022-03-21 16:48:12.750188
nvidia,Windows Central,Ben Wilson,The best Alienware desktops to enjoy PC gaming with ease,"Building a killer gaming PC can be a daunting task for a novice, with cutting-edge hardware running up costs and compatibility mismatches causing headaches. Even the most hardcore enthusiasts spring for a pre-built machine if individual parts suffer from chip…","Source: Dell

Best

Alienware desktop

Windows Central2022

Building a killer gaming PC can be a daunting task for a novice, with cutting-edge hardware running up costs and compatibility mismatches c… [+8353 chars]",https://www.windowscentral.com/best-alienware-desktop,https://www.windowscentral.com/sites/wpcentral.com/files/styles/large/public/field/image/2022/03/alienware_aurora_r13_motherboard.jpg,2022-03-15 19:48:02.000000,2022-03-21 16:48:12.750188
nvidia,Motley Fool,newsfeedback@fool.com (Anders Bylund),Better Buy: Netflix vs. Nvidia,"In a battle of growth-stock giants, one walks away with a clear win.","Few stocks see as much market action as Netflix( NFLX 1.62% ) and Nvidia( NVDA 2.93% ). On an average market day, Netflix shares worth roughly $2.8 billion are changing hands. Nvidia""s daily dollar v… [+3854 chars]",https://www.fool.com/investing/2022/03/15/better-buy-netflix-vs-nvidia/,https://g.foolcdn.com/editorial/images/670503/mature-couple-watching-tv-with-popcorn.jpg,2022-03-15 14:15:00.000000,2022-03-21 16:48:12.750188
nvidia,GameSpot,Darryn Bonthuys,"Tiny Tina""s Wonderlands PC Requirements Revealed","Ahead of its release this month, Tiny Tina""s Wonderlands developer Gearbox has released the official minimum and recommended settings for the game on PC. Unsurprisingly, you won""t need a gaming rig that doubles as an Nvidia-branded Borg cube as the requiremen…","Ahead of its release this month, Tiny Tina""s Wonderlands developer Gearbox has released the official minimum and recommended settings for the game on PC. Unsurprisingly, you won""t need a gaming rig t… [+2135 chars]",https://www.gamespot.com/articles/tiny-tinas-wonderlands-pc-requirements-revealed/1100-6501525/,https://www.gamespot.com/a/uploads/screen_kubrick/1601/16018044/3952638-tinytinawonderlands.jpg,2022-03-15 16:00:00.000000,2022-03-21 16:48:12.750188
nvidia,Motley Fool,newsfeedback@fool.com (Rich Smith),Why Nvidia Stock Rocketed Higher Today,Cowen sees a bright metaverse future for Nvidia in 2030.,"What happened

After three days of uninterrupted selling, shares of semiconductor star Nvidia(NASDAQ:NVDA) soared on Tuesday -- up 6.5% as of 12:10 p.m. ET.

You can probably thank investment bank Co… [+1586 chars]",https://www.fool.com/investing/2022/03/15/why-nvidia-stock-rocketed-higher-today/,https://g.foolcdn.com/editorial/images/670552/concept-art-of-a-rocketship-on-a-laptop-on-a-semiconductor-chip-all-bathed-in-blue.jpg,2022-03-15 17:23:40.000000,2022-03-21 16:48:12.750188
nvidia,SlashGear,staff@slashgear.com (Gabriel Moss),What Is NVIDIA DLSS?,"NVIDIA, famous for its powerful graphics cards and AI deep learning technology, has introduced a process called DLSS, or Deep Learning Super Sampling",Video games are becoming far more graphically detailed and environmentally complex than ever before. These vast strides in visual fidelity are made possible in part due to new rendering processes suc… [+901 chars],https://www.slashgear.com/800166/what-is-nvidia-dlss/,https://www.slashgear.com/img/gallery/what-is-nvidia-dlss/l-intro-1647376045.jpg,2022-03-15 20:30:59.000000,2022-03-21 16:48:12.750188
nvidia,Motley Fool,newsfeedback@fool.com (Jose Najarro and Nicholas Rossolillo),Is Now the Time to Buy Nvidia Stock?,The company is priced for perfection. Does that mean investors should hold off?,"In this video clip from ""Semiconductor Revolution"" on Motley Fool Live,recorded on March 3, Motley Fool contributors Jose Najarro and Nicholas Rossolillo discuss why they""re cautiously bullish on Nvi… [+2058 chars]",https://www.fool.com/investing/2022/03/15/is-now-the-time-to-buy-nvidia-stock/,https://g.foolcdn.com/editorial/images/670591/gettyimages-investorcrypto.jpg,2022-03-15 18:52:40.000000,2022-03-21 16:48:12.750188
nvidia,Motley Fool,"newsfeedback@fool.com (Jose Najarro, Nicholas Rossolillo, and Billy Duberstein)","Should Investors Worry About Nvidia""s Latest Hack?","Three Motley Fool contributors explain why they""re not worried.","In late Februrary, Nvidia""s ( NVDA 6.51% ) internal network was hacked by a cyber gang known as Lapsus$0. The hackers threatened to begin leaking proprietary information if Nvidia refused to remove t… [+5027 chars]",https://www.fool.com/investing/2022/03/15/should-investors-worry-about-nvidias-latest-hack/,https://g.foolcdn.com/editorial/images/670571/gettyimages-computerhacker.jpg,2022-03-15 18:37:19.000000,2022-03-21 16:48:12.750188
nvidia,Theregister.com,Simon Sharwood,"Arm to drop up to 15 percent of staff – about 1,000 people","Move along, nothing to see here, totally not slimming down ahead of IPO – or a second IPO in China

Chip designer and licensor to the stars, Arm, has reportedly dropped around 1,000 workers onto unemployment queues.…<!--#include virtual=""/data_centre/_whitepap…","Chip designer and licensor to the stars, Arm, has reportedly dropped around 1,000 workers onto unemployment queues.

An email to staff from Arm CEO Rene Haas, seen and reported by the UK""s Daily Tele… [+2329 chars]",https://www.theregister.com/2022/03/15/arm_job_cuts/,https://regmedia.co.uk/2022/03/15/shutterstock_uk_flag_arm.jpg,2022-03-15 05:08:07.000000,2022-03-21 16:48:12.750188
nvidia,Motley Fool,newsfeedback@fool.com (Rich Smith),Why AMD Stock Rocketed Higher Today,A Cowen analyst foresees huge gains for semiconductor stocks this decade.,"What happened

After three days of uninterrupted selling, shares of semiconductor stalwart Advanced Micro Devices (NASDAQ:AMD) soared on Tuesday -- up 6.1% as of 2:15 p.m. ET.

Cowen &amp; Co. is at … [+1776 chars]",https://www.fool.com/investing/2022/03/15/why-amd-stock-rocketed-higher-today/,https://g.foolcdn.com/editorial/images/670558/concept-art-of-a-rocketship-on-a-laptop-on-a-semiconductor-chip-all-bathed-in-blue.jpg,2022-03-15 18:19:32.000000,2022-03-21 16:48:12.750188
nvidia,New Atlas,Michael Irving,Glasses-free 3D display extends viewing distance for more realistic images,"No matter how many times 3D displays emerge and fade, the tech refuses to die. Researchers from Soochow University have now developed a glasses-free 3D display prototype, which uses a series of nanostructured lenses to produce more realistic images that can b…","No matter how many times 3D displays emerge and fade, the tech refuses to die. Researchers from Soochow University have now developed a glasses-free 3D display prototype, which uses a series of nanos… [+2769 chars]",https://newatlas.com/technology/glasses-free-3d-display-nanostructured-lenses/,https://assets.newatlas.com/dims4/default/07d6653/2147483647/strip/true/crop/1080x567+0+119/resize/1200x630!/quality/90/?url=http%3A%2F%2Fnewatlas-brightspot.s3.amazonaws.com%2F47%2F5e%2F86152d1b479d9f2a469f0b173b37%2F3d-lens-2.png,2022-03-15 03:49:49.000000,2022-03-21 16:48:12.750188
nvidia,PC Gamer,Hope Corrigan,Nvidia to give away 8 RTX 3090s during GTC,"Winning a card is always great, but with the 3090 Ti set to launch soon, a 3090 is bit of an odd choice.","While we""re all hoping to see the end to the GPU shortage, we aren""t quite there yet. GPUs are hard to come by, especially good ones and though prices have started to come back down to Earth, they""re… [+1795 chars]",https://www.pcgamer.com/nvidia-to-give-away-8-rtx-3090s-during-gtc/,https://cdn.mos.cms.futurecdn.net/8M4UAwSpEwh7b4Mbf3zyZL-1200-80.jpg,2022-03-15 02:51:07.000000,2022-03-21 16:48:12.750188
nvidia,Seeking Alpha,JR Research,Pros And Cons Of Investing In Nvidia Stock,"NVIDIA could announce exciting new developments, contract wins and expanded use cases at its GTC starting on March 21. See the pros and cons of NVDA stock here.","Justin Sullivan/Getty Images News

Investment Thesis

 NVIDIA Corporation""s (NVDA) highly anticipated GTC would occur between March 21-24, as investors parse the latest developments by CEO Jensen Hua… [+10628 chars]",https://seekingalpha.com/article/4495512-pros-cons-investing-nvidia-stock,https://static.seekingalpha.com/cdn/s3/uploads/getty_images/957037022/image_957037022.jpg?io=getty-c-w750,2022-03-15 13:30:00.000000,2022-03-21 16:48:12.750188
nvidia,Motley Fool,"newsfeedback@fool.com (Billy Duberstein, Nicholas Rossolillo, and Jose Najarro)","Inside Intel""s Self-Driving Spinoff",Can Mobileye help bring autonomous vehicles to the mass market?,"At Intel""s ( INTC -0.25% ) recent investor day, the company revealed it would soon be spinning off its Mobileye subsidiary, which develops self-driving cars and driver-assist systems.

In this video … [+4076 chars]",https://www.fool.com/investing/2022/03/15/inside-intels-self-driving-spinoff/,https://g.foolcdn.com/editorial/images/670565/gettyimages-autonomousvehicle.jpg,2022-03-15 17:50:16.000000,2022-03-21 16:48:12.750188
nvidia,Neowin,usama.jawad@neowin.net (Usama Jawad),Arm is laying off 15% of its workforce following failed Nvidia deal,"Arm has confirmed that it is cutting nearly 1,000 jobs in the wake of its failed Nvidia deal. The removal of ""redundant"" personnel will primarily impact those in the U.S. and the UK. Read more...","Last month, we reported that Nvidia""s $40 billion acquisition of UK chipmaker Arm has failed due to regulatory hurdles. Arm is currently owned by Japanese conglomerate SoftBank, which purchased the c… [+1559 chars]",https://www.neowin.net/news/arm-is-laying-off-15-of-its-workforce-following-failed-nvidia-deal/,https://cdn.neow.in/news/images/uploaded/2021/08/1628021487_arm-uk_story.jpg,2022-03-15 13:26:01.000000,2022-03-21 16:48:12.750188
nvidia,BBC News,https://www.facebook.com/bbcnews,Chip giant Arm set to axe 15% of its staff after deal fails,The UK technology firm could cut hundreds of jobs after its $40bn sale to US chipmaker Nvidia failed.,"Image source, Getty Images

Image caption, There is a global shortage of microchips

British microchip designer Arm Holdings has said it plans to cut up to 15% of its workforce.

The redundancies hav… [+1266 chars]",https://www.bbc.co.uk/news/business-60745707,https://ichef.bbci.co.uk/news/1024/branded_news/6003/production/_123197542_gettyimages-1307216100.jpg,2022-03-15 00:59:32.000000,2022-03-21 16:48:12.750188
nvidia,Creative Bloq,beren.neale@futurenet.com (Beren Neale),The lowest Surface Laptop Studio prices in {month} {year},The new Surface Laptop Studio can handle the most demanding of digital creative work.,"Getting one of the best Surface Laptop Studio deals is a great idea for any creative professional looking to get a premium desktop alternative that can handle all sorts of intense work, and also conf… [+1130 chars]",https://www.creativebloq.com/deals/microsoft-surface-laptop-studio-deals,https://cdn.mos.cms.futurecdn.net/JeybEq2BkNVrqRbtDxoGSf-1200-80.jpg,2022-03-15 12:28:53.000000,2022-03-21 16:48:12.750188
nvidia,Hackaday,Jonathan Bennett,"This Week in Security: Ukraine, Nvidia, and Conti","The geopolitics surrounding the invasion of Ukraine are outside the scope of this column, but the cybersecurity ramifications are certainly fitting fodder. The challenge here is that almost everything of …read more","The geopolitics surrounding the invasion of Ukraine are outside the scope of this column, but the cybersecurity ramifications are certainly fitting fodder. The challenge here is that almost everythin… [+8492 chars]",https://hackaday.com/2022/03/04/this-week-in-security-ukraine-nvidia-and-conti/,https://hackaday.com/wp-content/uploads/2016/01/darkarts.jpg,2022-03-04 15:00:09.000000,2022-03-21 16:48:12.924745
nvidia,Slashdot.org,msmash,Cybercriminals Who Breached Nvidia Issue One of the Most Unusual Demands Ever,"shanen shares a report: Data extortionists who stole up to 1 terabyte of data from Nvidia have delivered one of the most unusual ultimatums ever in the annals of cybercrime: allow Nvidia""s graphics cards to mine cryptocurrencies faster or face the imminent re…",The Fine Print: The following comments are owned by whoever posted them. We are not responsible for them in any way.,https://tech.slashdot.org/story/22/03/04/191244/cybercriminals-who-breached-nvidia-issue-one-of-the-most-unusual-demands-ever,https://a.fsdn.com/sd/topics/security_64.png,2022-03-04 20:02:00.000000,2022-03-21 16:48:12.924745
nvidia,Gizmodo.com,Asha Barbaschow,Lenovo Unveils New Range of Portable Machines for More Casual Gamers,"Lenovo has released a new range of laptops it says are perfect for “younger” or “new” gamers entering the world of gaming – they also wouldn’t be terrible portable machines for more casual play, with a max weight of 2.5 kgs.Read more...","Lenovo has released a new range of laptops it says are perfect for younger or new gamers entering the world of gaming they also wouldnt be terrible portable machines for more casual play, with a max … [+4151 chars]",https://gizmodo.com/lenovo-unveils-new-range-of-portable-machines-for-more-1848613999,"https://i.kinja-img.com/gawker-media/image/upload/c_fill,f_auto,fl_progressive,g_center,h_675,pg_1,q_80,w_1200/968c6c69b277b486f745478c3bb4e847.png",2022-03-04 21:17:00.000000,2022-03-21 16:48:12.924745
nvidia,Rock Paper Shotgun,James Archer,Nvidia GeForce RTX 3050 review: DLSS for less,"The Nvidia GeForce RTX 3050 might be the first GPU to benefit, in a roundabout way, from the bonkers price gouging that’s been spoiling the fun of graphics cards for nearly two years. In normal times, it wouldn’t make much sense to buy this £239 / $249 GPU – …","The Nvidia GeForce RTX 3050 might be the first GPU to benefit, in a roundabout way, from the bonkers price gouging that’s been spoiling the fun of graphics cards for nearly two years. In normal times… [+9515 chars]",https://www.rockpapershotgun.com/nvidia-geforce-rtx-3050-review,https://assets2.rockpapershotgun.com/msi-geforce-rtx-3060-gaming-x-trio.jpg/BROK/thumbnail/1600x900/format/jpg/quality/80/msi-geforce-rtx-3060-gaming-x-trio.jpg,2022-03-04 14:44:11.000000,2022-03-21 16:48:12.924745
nvidia,MakeUseOf,Tashreef Shareef,How to Fix Mouse Lag in Windows 11 and 10,"If your mouse isn""t as fast as you are, here are some ways to speed it back up.","Sometimes, you may notice that your mouse pointer will lag. This is irrespective of whether you have an external USB or wireless mouse connected to your Windows PC. While the reasons for mouse lag ca… [+7212 chars]",https://www.makeuseof.com/windows-11-mouse-lag/,https://static1.makeuseofimages.com/wordpress/wp-content/uploads/2022/02/fix-mouse-lag-windows-11.jpg,2022-03-04 16:15:14.000000,2022-03-21 16:48:12.924745
nvidia,Techmeme.com,,"Have I Been Pwned: hackers stole 71,000 Nvidia staff credentials, including email IDs and Windows password hashes, many of which were ""cracked and circulated"" (Carly Page/TechCrunch)","Carly Page / TechCrunch:

Have I Been Pwned: hackers stole 71,000 Nvidia staff credentials, including email IDs and Windows password hashes, many of which were “cracked and circulated”  —  The ransomware group that claims to have taken a terabyte of data from …","CB Insights Newsletter

724,948 subscribers get our free newsletter to stay a step ahead on technology trends, venture capital, startups, and the industries of tomorrow.",https://www.techmeme.com/220304/p27,https://techcrunch.com/wp-content/uploads/2022/03/GettyImages-1272953815-nvidia.jpg?w=599,2022-03-04 21:15:01.000000,2022-03-21 16:48:12.924745
nvidia,TechCrunch,Carly Page,"Thousands of Nvidia employee passwords leak online as hackers"" ransom deadline looms",The ransomware group that claims to have taken a terabyte of data from chipmaking giant Nvidia is threatening to release the company’s “most closely-guarded ...,"The ransomware group that claims to have taken a terabyte of data from chipmaking giant Nvidia is threatening to release the companys most closely-guarded secrets today unless it meets the gang""s inc… [+2229 chars]",https://techcrunch.com/2022/03/04/nvidia-ransomware-hackers-demands/,https://s.yimg.com/ny/api/res/1.2/cRw2u_7K2cXJAhE_FGd4Aw--/YXBwaWQ9aGlnaGxhbmRlcjt3PTEyMDA7aD04MDE-/https://s.yimg.com/uu/api/res/1.2/_87t2vH0c8XCyx3QD6g7_Q--~B/aD0xMzM1O3c9MjAwMDthcHBpZD15dGFjaHlvbg--/https://media.zenfs.com/en/techcrunch_350/80312dcff7581070b081fb3a0b3b7c01,2022-03-04 15:09:43.000000,2022-03-21 16:48:12.924745
nvidia,Motley Fool,newsfeedback@fool.com (James Brumley),Why Nvidia Lost More of Its Value Than the Broad Market Did on Friday,"A hacker group""s deadline appears to have come and gone without any response from the company, although it doesn""t necessarily matter.","What happened

Shares of Nvidia(NASDAQ:NVDA) ended Friday""s session down to the tune of 3.3%, outpacing the overall market""s setback of around 1%. While much of the stock""s weakness can be chalked up… [+1931 chars]",https://www.fool.com/investing/2022/03/04/why-nvidia-lost-more-of-its-value-than-the-broad-m/,https://g.foolcdn.com/editorial/images/669195/falling-chart-on-chalk-board.jpg,2022-03-04 21:48:43.000000,2022-03-21 16:48:12.924745
nvidia,Windows Central,John Levite,Save $400 on the Razer Blade 15 gaming laptop with RTX 3070 graphics,"You can grab the Razer Blade 15 gaming laptop on sale for $1,999.99 at Amazon. That""s a huge discount considering it has been selling for around $2,400 since last year and was going for as much as $2,600 in December. Today""s deal price is the lowest we have e…","You can grab the Razer Blade 15 gaming laptop on sale for $1,999.99 at Amazon. That""s a huge discount considering it has been selling for around $2,400 since last year and was going for as much as $2… [+1679 chars]",https://www.windowscentral.com/save-400-razer-blade-15-gaming-laptop-rtx-3070-graphics-card,https://www.windowscentral.com/sites/wpcentral.com/files/styles/large/public/field/image/2022/03/razer-blade-10th-gen-laptop.jpg,2022-03-04 20:20:02.000000,2022-03-21 16:48:12.924745
nvidia,PC Gamer,jorge.jimenez@futurenet.com (Jorge Jimenez),"Nvidia hackers leak employee credentials, threaten to release ""Nvidia""s most closely guarded trade secrets""","Nvidia employee emails and passwords are now already being ""cracked and circulated within the hacking community.""","Hacker group Lapsus$ has leaked the credentials of more than 71,000 Nvidia employees after the company did not acquiesce to its demands. The group stole the corporate data during a recent ransomware … [+2111 chars]",https://www.pcgamer.com/nvidia-hackers-leak-employee-credentials-threaten-to-release-nvidias-most-closely-guarded-trade-secrets/,https://cdn.mos.cms.futurecdn.net/c7nVEMHKfBfXbDnyay5HWS-1200-80.jpeg,2022-03-04 22:12:35.000000,2022-03-21 16:48:12.924745
nvidia,MakeUseOf,Tashreef Shareef,How To Fix Display Driver Stopped Responding In Windows 11/10,"Is your screen going black randomly? It""s an annoying and worrying issue, but there are ways to fix the issue.","When Windows detects issues with your display driver, it will terminate and restart the process linked to it. This will cause your screen to go blank momentarily followed by the display driver stoppe… [+7556 chars]",https://www.makeuseof.com/windows-display-driver-stopped-responding/,https://static1.makeuseofimages.com/wordpress/wp-content/uploads/2022/02/display-driver-stopped-responding-and-has-recovered.jpg,2022-03-04 17:16:13.000000,2022-03-21 16:48:12.924745
nvidia,TechCrunch,TechCrunchJapan Admin,【3月4日】掲載記事アクセスランキング・トップ5―1位はContiの内部チャットログ流出、2位はNVIDIA機密データ流出,"掲載記事のうち、3月4日午前7時現在集計で最もアクセスのあった記事5本を紹介。

<h2>第1位：<a target=""_blank"" href=""https://jp.techcrunch.com/2022/03/01/2022-02-28-conti-ransomware-chats-leaked"" rel=""noopener"">ロシアのウクライナ侵攻支持を宣言したContiランサムウェアグループの内部チャットがネットに流出</a></h2>

<img class=""aligncenter wp-image…","3475

ContiVX-Underground

NVIDIA31TechCrunch

31NXC2

4

Alphabet228GoogleReuters

Brands&amp;People on UnsplashNurPhoto / Getty ImagesAkos Stiller / Bloomberg / Getty ImagesNexon founder Jung-ju Ja… [+52 chars]",https://jp.techcrunch.com/2022/03/04/techcrunch-article-ranking-2022-03-04/,https://jp.techcrunch.com/wp-content/uploads/2022/03/2022-03-04-002-index.jpg?w=1024,2022-03-04 02:00:30.000000,2022-03-21 16:48:12.924745
nvidia,MarketWatch,Steve Goldstein,"Need to Know: Why Russia’s invasion of Ukraine may be the preamble to a second Cold War, leading to more volatility and supply shocks","It""s going to get rockier as a second split between East and West is being created.","To say this has been an eventful week has been an understatement. Through Friday morning, the 16% weekly surge in the S&amp;P GSCI index 

 SPGSCI,

 +0.85%

tracking commodities is the highest in at… [+4844 chars]",https://www.marketwatch.com/story/why-russias-invasion-of-ukraine-may-be-the-preamble-to-a-second-cold-war-leading-to-more-volatility-and-supply-shocks-11646395477,https://images.mktw.net/im-498026/social,2022-03-04 12:04:00.000000,2022-03-21 16:48:12.924745
nvidia,redmondpie.com,Oliver Haslam,Alienware’s 17-Inch Gaming Laptop With NVIDIA GeForce RTX 3060 Is Currently $450 Off,"Amazon is now selling the Alienware x17 R1 gaming laptop for just $1,928.98. There are no discount codes or on-screen coupons for you to remember to use here, but you do probably need to make sure to place an order soon if you intend to pick this thing up.

Th…","Amazon is now selling the Alienware x17 R1 gaming laptop for just $1,928.98. There are no discount codes or on-screen coupons for you to remember to use here, but you do probably need to make sure to… [+1334 chars]",https://www.redmondpie.com/alienwares-17-inch-gaming-laptop-with-nvidia-geforce-rtx-3060-is-currently-450-off/,https://cdn.redmondpie.com/wp-content/uploads/2022/03/Alienware-X17-Deal-1.jpg,2022-03-04 11:49:42.000000,2022-03-21 16:48:12.924745
