nvidia,Apkmirror.com,,Nova Video Player 6.0.52-20220311.2137 by Courville Software,Nova Video Player 6.0.52-20220311.2137 APK Download by Courville Software - APKMirror Free and safe Android APK downloads,"Nova is an opeN sOurce Video plAyer designed for tablets, phones and AndroidTV devices.available at github.com/nova-video-player/aos-AVP

Universal player:- Play videos from your computer, server (FT… [+1862 chars]",https://www.apkmirror.com/apk/courville-software/nova-video-player/nova-video-player-6-0-52-20220311-2137-release/,https://www.apkmirror.com/wp-content/uploads/2022/03/27/622d30ffdc639-384x384.png,2022-03-13 00:33:42.000000,2022-03-21 16:48:14.817530
nvidia,Forbes,"Lawrence Wintermeyer, Contributor, 

 Lawrence Wintermeyer, Contributor

 https://www.forbes.com/sites/lawrencewintermeyer/",What Does The Future Hold For Bitcoin Mining?,"Mining bans put the future of bitcoin at stake and the opportunity to exercise financial self-sovereignty via a decentralized cryptocurrency. More than ever, in the current state of global political and economic volatility, access to bitcoin is increasingly s…","Two technicians inspect bitcoin mining at Bitfarms in Saint Hyacinthe, Quebec. (Photo by Lars ... [+] Hagberg / AFP) (Photo by LARS HAGBERG/AFP via Getty Images)

AFP via Getty Images

From the outsi… [+17583 chars]",https://www.forbes.com/sites/lawrencewintermeyer/2022/03/13/what-does-the-future-hold-for-bitcoin-mining/,https://imageio.forbes.com/specials-images/imageserve/622d9cb7d593ec1d8bcb45fb/0x0.jpg?format=jpg&width=1200&fit=bounds,2022-03-13 08:00:03.000000,2022-03-21 16:48:14.817530
nvidia,Wccftech,Omar Sohail,"Rare Premium Gaming Laptop Deal Brings an RTX 3070-Powered Lenovo Legion 5 Pro Down to Just $1,589.99","The Legion 5 Pro is regarded as one of the best premium gaming laptops on the market. Unfortunately, the chip shortage made things more than challenging for both Lenovo and customers as the waiting time to get one of these spanned months, and even if you coul…","The Legion 5 Pro is regarded as one of the best premium gaming laptops on the market. Unfortunately, the chip shortage made things more than challenging for both Lenovo and customers as the waiting t… [+1852 chars]",https://wccftech.com/fully-powered-rtx-3070-lenovo-legion-5-pro-down-to-1589-99/,https://cdn.wccftech.com/wp-content/uploads/2022/03/Legion-5-Pro.jpg,2022-03-13 15:14:08.000000,2022-03-21 16:48:14.817530
nvidia,Notebookcheck.net,Daniel R Deakin,Sizzling GeForce RTX 4090 TGP allegedly confirmed at 600 W with potential for over 800 W for the RTX 4090 Ti,"The Total Graphics Power (TGP) figure for the Nvidia GeForce RTX 4090 has supposedly been confirmed. Apparently, it stands at a toasty 600 W, considerably higher than its Ampere counterpart. In addition, an astonishing figure of 800 W or more for the potentia…","Once again, two of the most noted graphics card-related leakers have been offering up information and rumors about the upcoming Lovelace series from Nvidia. While a naming scheme has yet to be confir… [+1588 chars]",https://www.notebookcheck.net/Sizzling-GeForce-RTX-4090-TGP-allegedly-confirmed-at-600-W-with-potential-for-over-800-W-for-the-RTX-4090-Ti.607980.0.html,https://www.notebookcheck.net/fileadmin/Notebooks/News/_nc3/GeForce_RTX_4090_TGP_power_heat_drdNBC.jpg,2022-03-13 22:12:00.000000,2022-03-21 16:48:14.817530
nvidia,Awealthofcommonsense.com,Ben Carlson,Is a Recession Bullish For Tech Stocks?,Do tech stocks need inflation to fall to outperform again?...,"No two market environments are ever the same but there are certainly similarities across time.

For instance, the post-Corona Crash period in 2020 that seeped into the first couple months of 2021 sha… [+5667 chars]",https://awealthofcommonsense.com/2022/03/is-a-recession-bullish-for-tech-stocks/,https://awealthofcommonsense.com/wp-content/uploads/2022/03/Screenshot-2022-03-13-120814.png,2022-03-13 16:06:45.000000,2022-03-21 16:48:14.817530
nvidia,Slickdeals.net,TenseTest7770,CORSAIR VENGEANCE i7300 Series Gaming Desktop Intel Core i7 12700K 32GB Memory NVIDIA GeForce RTX 3070 Ti 1TB SSD CS-9050035-BB - Best Buy $2749.99,"Best buy has for 2749.99 gaming computer 

 

https://www.bestbuy.com/site/corsair-vengeance-i7300-series-gaming-desktop-intel-core-i7-12700k-32gb-memory-nvidia-geforce-rtx-3070-ti-1tb-ssd/6498154.p?sku ...",Your vote will help the community find the best deals.,https://slickdeals.net/f/15667942-corsair-vengeance-i7300-series-gaming-desktop-intel-core-i7-12700k-32gb-memory-nvidia-geforce-rtx-3070-ti-1tb-ssd-cs-9050035-bb-best-buy-2749-99,https://static.slickdealscdn.com/attachment/1/8/4/2/8/7/8/5/11266627.attach,2022-03-13 03:53:54.000000,2022-03-21 16:48:14.817530
nvidia,Notebookcheck.net,Allen Ngo,Razer Blade 15 2022 vs. Blade 15 2018: Four years of accumulating improvements,"The Razer Blade 15 series has been utilizing the same chassis design for almost five years running. Despite the lack of any major physical changes between yearly models, the internal updates have nonetheless added up over time. If you have the original 2018 m…","The current Blade 15 design launched in 2018 with Intel 8th gen CPUs and Nvidia Pascal GPUs. Though there have been minor physical changes year-over-year, the overall visual design has remained essen… [+1837 chars]",https://www.notebookcheck.net/Razer-Blade-15-2022-vs-Blade-15-2018-Four-years-of-accumulating-improvements.607864.0.html,https://www.notebookcheck.net/fileadmin/Notebooks/Razer/Blade_15_2022/IMG_20220309_104653.jpg,2022-03-13 21:07:00.000000,2022-03-21 16:48:14.817530
nvidia,Askubuntu.com,xxlali,Ubuntu 21.10 Color Problem on HDMI and DP,"I use two monitor (one on DP one on HDMI) on my MSI Ge76 Laptop. I use Ubuntu 21.10 with Windows as dual boot. My kernel: 5.16.0-12.2-liquorix-amd64. I have color problem on my monitors. When I googled about the problem, first solution I found was calibrating…",I use two monitor (one on DP one on HDMI) on my MSI Ge76 Laptop. I use Ubuntu 21.10 with Windows as dual boot. My kernel: 5.16.0-12.2-liquorix-amd64. I have color problem on my monitors. When I googl… [+577 chars],https://askubuntu.com/questions/1397349/ubuntu-21-10-color-problem-on-hdmi-and-dp,https://cdn.sstatic.net/Sites/askubuntu/Img/apple-touch-icon@2.png?v=c492c9229955,2022-03-13 17:03:57.000000,2022-03-21 16:48:14.817530
nvidia,Insurance Business UK,Lyle Adriano,Hackers allegedly leak 190GB of data from Samsung - Insurance Business,"<ol><li>Hackers allegedly leak 190GB of data from Samsung  Insurance Business

</li><li>Nvidia hackers leak 190GB of sensitive data from Samsung  TechSpot

</li><li>Hackers leak 190GB of data taken in alleged Samsung breach  AppleInsider

</li><li>Nvidia hack…",BleepingComputer reported that the stolen data supposedly on the cache include source code for every Trusted Applet (TA) installed in Samsung’s TrustZone platform; algorithms for biometric unlock fun… [+782 chars],https://www.insurancebusinessmag.com/ca/news/cyber/hackers-allegedly-leak-190gb-of-data-from-samsung-397536.aspx,https://cdn-res.keymedia.com/cms/images/us/023/0270_637822449783866748.png,2022-03-07 10:23:29.000000,2022-03-21 16:48:14.960762
nvidia,Digital Trends,Zak Islam,Hackers are using stolen Nvidia certificates to hide malware,"According to security researchers, Nvidia code-signing certificates that were extracted via a hack of the chip maker are being used for malware purposes.","Nvidia code-signing certificates that were extracted from a recent hack of the chip maker are being used for malware purposes, according to security researchers.

Hacking group LAPSUS$ recently claim… [+3073 chars]",https://www.digitaltrends.com/computing/hackers-are-using-stolen-nvidia-certificates-to-hide-malware/,https://icdn.digitaltrends.com/image/digitaltrends/history-of-malware-feat.jpg,2022-03-07 15:12:54.000000,2022-03-21 16:48:14.960762
nvidia,Windows Central,Sean Endicott,Stolen NVIDIA data is being used to bypass Windows security,"Threat actors are using stolen data from the NVIDIA hack to attack PCs.







What you need to know





A ransomware group known as Lapsus$ has leaked stolen data from NVIDIA as part of a hack.

The leaked data includes code signing certificates, which are now bein…","The ongoing drama surrounding the NVIDIA hack by Lapsus$ has another chapter, and it""s putting computers at risk. The ransomware group known as Lapsus$ hacked NVIDIA in February 2022. The group threa… [+1330 chars]",https://www.windowscentral.com/leaked-nvidia-data-being-used-bypass-windows-security-and-attack-pcs,https://www.windowscentral.com/sites/wpcentral.com/files/styles/large/public/field/image/2017/02/hp-spectre-15-nvidia.jpg,2022-03-07 18:54:21.000000,2022-03-21 16:48:14.960762
nvidia,Windows Central,Cale Hunt,"Review: Acer""s Predator X28 4K gaming monitor is ideal for high-end PCs","Acer puts it all together with the 28-inch 4K Predator X28.



As 4K UHD resolution becomes more common thanks to more powerful PC and console hardware, monitors must keep up. And while there have long been 4K displays on the market, those with high-end competi…","Source: Windows Central

As 4K UHD resolution becomes more common thanks to more powerful PC and console hardware, monitors must keep up. And while there have long been 4K displays on the market, tho… [+12111 chars]",https://www.windowscentral.com/acer-predator-x28-review,https://www.windowscentral.com/sites/wpcentral.com/files/styles/large/public/field/image/2022/03/acer-predator-x28-review-01.jpg,2022-03-07 18:00:02.000000,2022-03-21 16:48:14.960762
nvidia,PetaPixel,Jaron Schneider,Hackers Breached Samsung Security and Stole Galaxy Source Code,"Samsung has confirmed that hackers breached its data security and were able to steal Galaxy smartphone source code. The company says the cyberattack did not affect customer or employee information.

[Read More]","Samsung has confirmed that hackers breached its data security and were able to steal Galaxy smartphone source code. The company says the cyberattack did not affect customer or employee information. 

… [+2153 chars]",https://petapixel.com/2022/03/07/hackers-breached-samsung-security-and-stole-galaxy-source-code/,https://petapixel.com/assets/uploads/2022/03/Hackers-Breach-Samsung-Security-Steal-Galaxy-Source-Code.jpg,2022-03-07 17:07:57.000000,2022-03-21 16:48:14.960762
nvidia,Motley Fool,newsfeedback@fool.com (Rich Smith),Why Nvidia Stock Tanked Today,"Goldman Sachs kind of likes Nvidia -- but can""t recommend buying it.","What happened

Shares of Nvidia( NVDA -4.66% ) stock fell off a cliff Monday morning, tumbling 4% by noon ET. That""s actually a bit surprising though, given the news today:

Goldman Sachs just reinit… [+1804 chars]",https://www.fool.com/investing/2022/03/07/why-nvidia-stock-tanked-today/,https://g.foolcdn.com/editorial/images/669377/white-arrow-declining-sharply-atop-a-stock-tickertape-display-bathed-in-red.jpg,2022-03-07 17:32:17.000000,2022-03-21 16:48:14.960762
nvidia,Theregister.com,Gareth Corfield,Lapsus$ extortionists dump data online as Samsung admits breach,"190GB worth of internal files, looks like source code for proprietary tech including Knox, Bootloader and more

Samsung has acknowledged its data was stolen after the Lapsus$ extortion gang deposited what appears to be 190GB of the company""s stolen internal fi…","Samsung has acknowledged its data was stolen after the Lapsus$ extortion gang deposited what appears to be 190GB of the company""s stolen internal files online.

""We were recently made aware that ther… [+3719 chars]",https://www.theregister.com/2022/03/07/samsung_lapsus_data_theft/,https://regmedia.co.uk/2020/10/29/shutterstock_samsung_editorial_only.jpg,2022-03-07 17:11:51.000000,2022-03-21 16:48:14.960762
nvidia,XDA Developers,Corbin Davenport,Samsung confirms hackers stole source code for Galaxy phones,"Samsung often speaks highly of its security measures, especially around the Samsung Knox technology available on Galaxy devices and other products, but no company (or government) is immune to security breaches. Samsung confirmed on Monday that it suffered a s…","Samsung often speaks highly of its security measures, especially around the Samsung Knox technology available on Galaxy devices and other products, but no company (or government) is immune to securit… [+2875 chars]",https://www.xda-developers.com/samsung-hack-source-code-galaxy-phones/,https://www.xda-developers.com/files/2022/02/Samsung-Galaxy-S22-Plus-11.jpg,2022-03-07 20:04:44.000000,2022-03-21 16:48:14.960762
nvidia,AppleInsider,news@appleinsider.com (Darryl Boxberger),Comcast and Apple announce launch of Apple TV+ on Xfinity platforms,"Comcast has announced that Apple TV+ will be launching on its Xfinity entertainment platform starting on March 7, 2022.In an announcement on Monday, Comcast and Apple announced that Apple TV+ will launch across its Xfinity X1, Xfinity Flex, and XClassTV set-t…",AppleInsider is supported by its audience and may earn commission as an Amazon Associate and affiliate partner on qualifying purchases. These affiliate partnerships do not influence our editorial con… [+1429 chars],https://appleinsider.com/articles/22/03/07/comcast-and-apple-announce-launch-of-apple-tv-on-xfinity-platforms,https://photos5.appleinsider.com/gallery/45543-88636-000-lead-Comcast-Xfinity-xl.jpg,2022-03-07 22:24:19.000000,2022-03-21 16:48:14.960762
nvidia,XDA Developers,João Carrasqueira,MSI launches Aegis ZS desktop with AMD processors and GPUs,"MSI has announced a new addition to its lineup of gaming desktop PCs, the all-AMD Aegis ZS. This new member of the Aegis family is powered by AMD processors and GPUs, so it might be a great choice if you want to avoid Intel and NVIDIA for whatever reason. You…","MSI has announced a new addition to its lineup of gaming desktop PCs, the all-AMD Aegis ZS. This new member of the Aegis family is powered by AMD processors and GPUs, so it might be a great choice if… [+1969 chars]",https://www.xda-developers.com/msi-aegis-zs-all-amd/,https://www.xda-developers.com/files/2022/03/MSI-Aegis-ZS-colored-background.jpg,2022-03-07 15:40:01.000000,2022-03-21 16:48:14.960762
nvidia,Windows Central,John Levite,"Get a 240Hz refresh rate with Dell""s gaming monitor on sale for just $210","Dell""s S2522HG 24.5-inch 240Hz gaming monitor has dropped to a low price of just $209.99 through Amazon. This is a really good deal. Not only is it the lowest price we""ve ever seen for this display, we""re talking about a monitor that regularly sells for aroun…","Dell""s S2522HG 24.5-inch 240Hz gaming monitor has dropped to a low price of just $209.99 through Amazon. This is a really good deal. Not only is it the lowest price we""ve ever seen for this display, … [+1648 chars]",https://www.windowscentral.com/dell-s2522hg-24-inch-240hz-gaming-monitor-amazon-sale,https://www.windowscentral.com/sites/wpcentral.com/files/styles/large/public/field/image/2022/03/dell-245-inch-240hz-monitor.jpg,2022-03-07 13:00:00.000000,2022-03-21 16:48:14.960762
nvidia,Motley Fool,newsfeedback@fool.com (Rich Smith),"Why Are Qualcomm, Micron, and AMD Stocks Falling?","Analysts are saying ""buy,"" but investors aren""t listening today.","What happened

Semiconductor stocks tumbled in afternoon trading Monday. By close of trading, Qualcomm (NASDAQ:QCOM) stock lost 7.5% and Micron Technology(NASDAQ:MU) was down 7.6%. Advanced Micro Dev… [+1945 chars]",https://www.fool.com/investing/2022/03/07/why-are-qualcomm-micron-and-amd-stocks-falling/,https://g.foolcdn.com/editorial/images/669432/3-stock-arrows-trending-down-against-a-cityscape-and-global-map-background.jpg,2022-03-07 23:29:52.000000,2022-03-21 16:48:14.960762
nvidia,Threatpost,Becky Bracken,"Samsung Confirms Lapsus$ Ransomware Hit, Source Code Leak",The move comes just a week after GPU-maker NVIDIA was hit by Lapsus$ and every employee credential was leaked.,"The move comes just a week after GPU-maker NVIDIA was hit by Lapsus$ and every employee credential was leaked.Just days after leaking data it claims to have exfiltrated from chipmaker NVIDIA, ransomw… [+4614 chars]",https://threatpost.com/samsung-lapsus-ransomware-source-code/178791/,https://media.threatpost.com/wp-content/uploads/sites/103/2020/08/11102207/samsung-galaxy.jpg,2022-03-07 19:28:36.000000,2022-03-21 16:48:14.960762
nvidia,PCWorld,Gordon Ung,The Full Nerd ep 208: Steam Deck reactions and Nvidia LHR malware,"In this episode of The Full Nerd, Gordon Ung, Brad Chacos, and Adam Patrick Murray mull reactions to Valve’s Steam Deck, malware disguised as a tool to unlock fulling mining capabilities on Nvidia graphics cards, and a new chiplet standard.









The initial V…","Skip to contentType your search and hit enter

In this episode of The Full Nerd, Gordon Ung, Brad Chacos, and Adam Patrick Murray mull reactions to Valve’s Steam Deck, malware disguised as a tool to … [+2047 chars]",https://www.pcworld.com/article/620122/the-full-nerd-ep-208-steam-deck-reactions-lhr-malware-and-a-chiplet-standard.html,https://www.pcworld.com/wp-content/uploads/2022/03/TFN22_208_TFNep208_V1.jpg?quality=50&strip=all&w=1024,2022-03-07 17:00:00.000000,2022-03-21 16:48:14.960762
nvidia,Threatpost,Lisa Vaas,Nvidia’s Stolen Code-Signing Certs Used to Sign Malware,"Nvidia certificates are being used to sign malware, enabling malicious programs to pose as legitimate and slide past security safeguards on Windows machines.","Nvidia certificates are being used to sign malware, enabling malicious programs to pose as legitimate and slide past security safeguards on Windows machines.Two of Nvidia’s code-signing certificates … [+5556 chars]",https://threatpost.com/nvidias-stolen-code-signing-certs-sign-malware/178784/,https://media.threatpost.com/wp-content/uploads/sites/103/2022/03/07124338/imposter-scaled-e1646675038217.jpeg,2022-03-07 17:46:39.000000,2022-03-21 16:48:14.960762
nvidia,TechRadar,Max Slater-Robins,Nvidia and IBM have a plan to connect GPUs straight to SSDs,Computing giants Nvidia and IBM detail plan to boost ML training and other tasks.,"Nvidia, IBM, and researchers have a plan to make the lives of those working in machine learning a bit easier: connecting GPUs directly to SSDs. 

Detailed in a research paper, the idea is called Big … [+1628 chars]",https://www.techradar.com/news/nvidia-and-ibm-have-a-plan-to-connect-gpus-straight-to-ssds,https://cdn.mos.cms.futurecdn.net/Aa9K2ugMAG9SeAYEQXSue-1200-80.jpg,2022-03-16 15:48:51.000000,2022-03-21 16:48:19.990287
nvidia,Phoronix,,VDPAU 1.5 Video Decode Library Released With AV1 Support,With the NVIDIA 510 series Linux driver back in January NVIDIA added AV1 video decode support to their Video Decode and Presentation API for Unix (VDPAU) driver. Now finally out is libvdpau 1.5 as the adjoining open-source VDPAU library update...,With the NVIDIA 510 series Linux driver back in January NVIDIA added AV1 video decode support to their Video Decode and Presentation API for Unix (VDPAU) driver. Now finally out is libvdpau 1.5 as th… [+1065 chars],https://www.phoronix.com/scan.php?page=news_item&px=libvdpau-1.5-VDPAU,https://www.phoronix.com/assets/categories/nvidia.jpg,2022-03-07 10:44:41.000000,2022-03-21 16:48:14.960762
nvidia,TechRadar,Sead Fadilpašić,Nvidia hackers hit Samsung and leak huge data dump,"If the data’s authenticity is confirmed, it could be a major headache for Samsung","The increasingly-notorious cybercrime group Lapsus$ has published a huge database, allegedly containing sensitive information from Samsung. 

The leak, containing 190GB of data broken into three sepa… [+1773 chars]",https://www.techradar.com/news/nvidia-hackers-hit-samsung-and-leak-huge-data-dump,https://cdn.mos.cms.futurecdn.net/SEXM8ah9EKKpBKB22d7Ak3-1200-80.jpg,2022-03-07 14:06:12.000000,2022-03-21 16:48:14.960762
nvidia,Ubergizmo,Tyler Lee,Hackers Leak 190GB Of Data In Samsung Breach,"So not too long ago, NVIDIA suffered a data breach and a lot of information was posted online, some of which seemed to suggest that NVIDIA could be working with Nintendo on a new chipset for a future Switch. Now it looks like Samsung is the second tech compan…","So not too long ago, NVIDIA suffered a data breach and a lot of information was posted online, some of which seemed to suggest that NVIDIA could be working with Nintendo on a new chipset for a future… [+1123 chars]",https://www.ubergizmo.com/2022/03/samsung-breach-190gb-data/,https://i0.wp.com/cdnssl.ubergizmo.com/wp-content/uploads/2019/10/hack-3.jpg,2022-03-07 02:00:17.000000,2022-03-21 16:48:14.960762
nvidia,"Investor""s Business Daily","Investor""s Business Daily","Sector Wars: Tesla Stock Tumbles As Two Leaders Rise, One Gets Sold Into Strength","As Tesla, Nvidia struggle, CF gets sold into strength and Union Pacific, Vertex fight the market.","Tech stocks Tesla (TSLA), Microsoft (MSFT) and Nvidia (NVDA) have taken a hit since hitting highs at the end of last year. Meanwhile, CF Industries (CF), Cheniere Energy (LNG) and Union Pacific (UNP)… [+2371 chars]",https://www.investors.com/research/how-to-find-the-best-stocks-to-buy/tesla-stock-tumbles-as-two-leaders-rise-one-gets-sold-into-strength/,https://www.investors.com/wp-content/uploads/2022/03/Stock-stockmarketpiechart-01-adobe.jpg,2022-03-07 21:20:04.000000,2022-03-21 16:48:14.960762
nvidia,PC Gamer,Katie Wickens,"Nvidia""s stolen data is being used to disguise malware as GPU drivers","Officially signed with Nvidia codes, RATs and Mimikatz are rife. Here are the signatures to look out for.","Because of leaked data linked to an Nvidia hack by a group calling itself Lapsus$, stolen code-signing certificates are being used to gain remote access to unsuspecting machines, and otherwise deploy… [+2619 chars]",https://www.pcgamer.com/nvidias-stolen-data-is-being-used-to-disguise-malware-as-gpu-drivers/,https://cdn.mos.cms.futurecdn.net/CvxHTxvrgEJNP5YbxpHhoh-1200-80.jpg,2022-03-07 13:15:14.000000,2022-03-21 16:48:14.960762
nvidia,VentureBeat,Dean Takahashi,Greg Estes interview: What to expect at Nvidia’s GTC event,"Nvidia wasn’t able to pull off its $80 billion acquisition of Arm, but the AI and graphics chip giant still has plenty to talk about at its upcoming Nvidia GTC online conference from March 21 to March 24. Greg Estes, vice president of developer programs at Nv…","Did you miss a session at the Data Summit? Watch On-Demand Here.

Nvidia wasnt able to pull off its $80 billion acquisition of Arm, but the AI and graphics chip giant still has plenty to talk about a… [+1193 chars]",https://venturebeat.com/2022/03/18/greg-estes-interview-what-to-expect-at-nvidias-gtc-event/,https://venturebeat.com/wp-content/uploads/2022/03/NVIDIA-Earth-2.jpg?w=1200&strip=all,2022-03-18 13:30:00.000000,2022-03-21 16:48:19.950884
nvidia,Digital Trends,Monica J. White,20 Nvidia RTX 3070 Ti GPUs stolen from warehouse in Russia,"Twenty Nvidia GeForce RTX 3070 Ti graphics cards have been stolen from a Russian warehouse, but the plan didn""t end well for the employees accused of the crime.","In a quiet heist gone wrong, 20 Nvidia GeForce RTX 3070 Ti graphics cards have been stolen from a Russian warehouse, allegedly by its employees.

Worth around $38,000, the graphics cards were success… [+2274 chars]",https://www.digitaltrends.com/computing/russian-warehouse-workers-steal-20-rtx-3070-ti-gpus/,https://icdn.digitaltrends.com/image/digitaltrends/screen-shot-2022-03-18-at-11-45-57-am.jpg,2022-03-18 19:36:17.000000,2022-03-21 16:48:19.950884
nvidia,Digital Trends,Zak Islam,Nvidia’s RTX 3080 GPU just received a record price cut,"One of the most popular graphics cards on the market, the Nvidia RTX 3080, has seen one of its biggest official price cuts since the GPU shortage began.","One of the most popular graphics cards on the market, the Nvidia RTX 3080, has seen one of its biggest official price cuts since the GPU shortage began.

Providing further proof that the video card i… [+2347 chars]",https://www.digitaltrends.com/computing/nvidia-rtx-3080-gpu-just-received-a-record-price-cut/,https://icdn.digitaltrends.com/image/digitaltrends/rtx-3080-07_new.jpg,2022-03-18 16:56:05.000000,2022-03-21 16:48:19.950884
nvidia,MSPoweruser,Alex Atkin,Nvidia is letting you win one of its illusive RTX 3090s,"Nvidia has announced a sweepstakes competition to let you win one of its ever-illusive GeForce RTX 3090s, so long as you jump through a few hoops first.  Nvidia has announced that in celebration of their upcoming 2022 Graphics Technology Conference they will …","Nvidia has announced a sweepstakes competition to let you win one of its ever-illusive GeForce RTX 3090s, so long as you jump through a few hoops first. 

Nvidia has announced that in celebration of … [+1150 chars]",https://mspoweruser.com/nvidia-is-letting-you-win-one-of-its-rtx-3090s/,https://mspoweruser.com/wp-content/uploads/2022/03/Nvidia-RTX-3090-Giveaway-180322.jpg,2022-03-18 15:34:12.000000,2022-03-21 16:48:19.950884
nvidia,Windows Central,Ben Wilson,"Discover the best PC under $1,000 for gamers and the home office","Pre-built computers can save you from the hassle of researching compatible components and troubleshooting hardware errors, focusing instead on finding a machine suited for specific games or software. PC gaming is notorious for being the more expensive choice …","Best

PC under $1,000

Windows Central2022

Pre-built computers can save you from the hassle of researching compatible components and troubleshooting hardware errors, focusing instead on finding a ma… [+3185 chars]",https://www.windowscentral.com/best-pc-under-1000,https://www.windowscentral.com/sites/wpcentral.com/files/styles/large/public/field/image/2022/03/cyberpowerpc-gamer-master-promo.jpg,2022-03-18 12:00:02.000000,2022-03-21 16:48:19.950884
