nvidia,PC Perspective,PCPer Staff,"Podcast #666 – Nvidia Hack, AMD Valuation, Intel buys Linutronix, FreeDOS, ICY Graphite Review, + we’re doomed!","This is the ill fated episode #666, with hellish lighting included.

Nvidia gets hacked in a big way, Intel buys a linux company, AMD was briefly valued at more then Intel, and even…","This is the ill fated episode #666, with hellish lighting included.

Nvidia gets hacked in a big way, Intel buys a linux company, AMD was briefly valued at more then Intel, and even FreeDOS gets upda… [+637 chars]",https://pcper.com/2022/03/pc-perspective-podcast-666/,https://pcper.com/wp-content/uploads/2022/02/podcast666.jpg,2022-03-05 18:40:09.000000,2022-03-21 16:48:13.436461
nvidia,Slickdeals.net,sr71,"ASUS TUF Gaming Laptop: i5-11260H, 17.3"" 144Hz, 8GB RAM, 512GB SSD RTX 3050 Ti $800 at Bestbuy",https://www.bestbuy.com/site/asus-tuf-gaming-17-3-laptop-intel-core-i5-8gb-memory-nvidia-geforce-rtx3050-ti-512gb-ssd-eclipse-grey/6485599.p?skuId=6485599,Your vote will help the community find the best deals.,https://slickdeals.net/f/15654559-asus-tuf-gaming-laptop-i5-11260h-17-3-144hz-8gb-ram-512gb-ssd-rtx-3050-ti-800-at-bestbuy,https://static.slickdealscdn.com/attachment/2/5/0/5/1/4/11240110.attach,2022-03-05 06:57:04.000000,2022-03-21 16:48:13.436461
nvidia,The Information,"Stephen Nellis, Sylvia Varnham O""Regan",Intel’s Decades-Old Russian Software Operations Underscore Tough Choices for U.S. Tech Firms,"When Intel Corp. suspended chip sales to Russia last week, it joined a stampede of U.S. tech companies cutting off sales after President Vladimir Putin’s invasion of Ukraine. But Intel’s ties to Russia run far deeper than chip sales. For more than two decades…","When Intel Corp. suspended chip sales to Russia last week, it joined a stampede of U.S. tech companies cutting off sales after President Vladimir Putin’s invasion of Ukraine. But Intel’s ties to Russ… [+852 chars]",https://www.theinformation.com/articles/intels-decades-old-russian-software-operations-underscore-tough-choices-for-u-s-tech-firms,https://tii.imgix.net/production/articles/7388/880150bb-a167-4220-96b3-ca60bb79c6fc.jpeg?w=800&fm=jpg&auto=compress&frame=0,2022-03-05 14:07:03.000000,2022-03-21 16:48:13.436461
nvidia,Wired,Lily Hay Newman,A Major Internet Backbone Company Cuts Off Russia,"Plus: A ransomware gang leak, an Nvidia hack, and more of the week""s top security news.","Russia""s War of choice against Ukraine drew global attention this week with Russian President Vladimir Putin continuing to escalate the conflict as the United States and Europe moved to drastically i… [+3824 chars]",https://www.wired.com/story/cogent-internet-backbone-cuts-off-russia-nvidia-ransomware-conti-security-news/,"https://media.wired.com/photos/6222ff519e8883344f3ae360/191:100/w_1280,c_limit/Security-Roundup-Russia-Internet-200161777-001.jpg",2022-03-05 14:00:00.000000,2022-03-21 16:48:13.436461
nvidia,Digital Trends,Monica J. White,This crafty crypto mining hack bypasses Nvidia’s LHR limiter,"A new custom-made version of Nvidia""s RTX 3060 has surfaced on the second-hand market. The GPU was made to override Nvidia""s anti-crypto-mining measures.","It seems that cryptocurrency mining enthusiasts found yet another way to bypass Nvidia’s Lite Hash Rate limiter (LHR) technology, although this time, it doesn’t involve using any new software.

Custo… [+2934 chars]",https://www.digitaltrends.com/computing/custom-nvidia-rtx-3060-overrides-lhr/,https://icdn.digitaltrends.com/image/digitaltrends/rtx3060lhr.jpg,2022-03-08 16:57:36.000000,2022-03-21 16:48:14.500199
nvidia,Windows Central,John Levite,"Step up your game with LG""s 1440p 144Hz monitor on sale for $347","If you""re looking to upgrade from 1080p or to something with a higher refresh rate for gaming, today""s your day. LG""s 27GL850-B 27-inch 1440p gaming monitor has dropped to just $346.99 at Amazon. This price matches its low, and it""s a price it has usually onl…","If you""re looking to upgrade from 1080p or to something with a higher refresh rate for gaming, today""s your day. LG""s 27GL850-B 27-inch 1440p gaming monitor has dropped to just $346.99 at Amazon. Thi… [+1879 chars]",https://www.windowscentral.com/step-your-game-lgs-1440p-144hz-monitor-sale-347,https://www.windowscentral.com/sites/wpcentral.com/files/styles/large/public/field/image/2022/03/lg-ultragear-1440p-monitor.jpg,2022-03-08 16:20:02.000000,2022-03-21 16:48:14.500199
nvidia,HYPEBEAST,"info@hypebeast.com (HYPEBEAST), HYPEBEAST",Samsung Confirms Losing Galaxy Source Code to Hackers,"Samsung has now confirmed previous rumors that it had fallen victim to a hack from South American group Lapsus$.According to the Korean tech giant, hackers managed to obtain the source code for its Galaxy devices and possibly sensitive and confidential data r…","Samsung has now confirmed previous rumors that it had fallen victim to a hack from South American group Lapsus$.

According to the Korean tech giant, hackers managed to obtain the source code for its… [+1328 chars]",https://hypebeast.com/2022/3/samsung-galaxy-source-code-hack-lapsus-confirmed,https://image-cdn.hypb.st/https%3A%2F%2Fhypebeast.com%2Fimage%2F2022%2F03%2Fsamsung-galaxy-source-code-hack-lapsus-confirmed-tw.jpg?w=960&cbr=1&q=90&fit=max,2022-03-08 06:04:07.000000,2022-03-21 16:48:14.500199
nvidia,Cracked.com,LePit,"PC Gamers Beware: The Nvida Hack, And What To Do About It",Be wary of any beautifully rendered horses you might come across,"In the past, we""ve covered how the mess that is crypto mining harms your chances of getting new gaming hardware and destroys your chances of getting it at a reasonable price. Luckily, after over a ye… [+1471 chars]",https://www.cracked.com/article_32905_pc-gamers-beware-the-nvida-hack-and-what-to-do-about-it.html,https://s3.crackedcdn.com/phpimages/article/1/0/9/832109.jpg,2022-03-08 16:30:00.000000,2022-03-21 16:48:14.500199
nvidia,Internet,noreply@blogger.com (Ravie Lakshmanan),Samsung Confirms Data Breach After Hackers Leak Galaxy Source Code,"Samsung on Monday confirmed a security breach that resulted in the exposure of internal company data, including the source code related to its Galaxy smartphones.

""According to our initial analysis, the breach involves some source code relating to the operati…","Samsung on Monday confirmed a security breach that resulted in the exposure of internal company data, including the source code related to its Galaxy smartphones.

""According to our initial analysis,… [+2076 chars]",https://thehackernews.com/2022/03/samsung-confirms-data-breach-after.html,https://thehackernews.com/new-images/img/a/AVvXsEgFtF5wpCzSBdf6ntWP1-9p-FfSAjjaGhYgTr4dryXKhIg8NQO_vbXIw1N4BNPhoE94N4nVwYeyrdpmQwQ8zsutUPFlFyCJ620tIKtbSpA0iol9ouebyAntQ2ZWToPww765LpCLBXxsQGvktGLKvsUFy8CBikovjarXSpxiUV6JTzL_A8DEQsRYHlVO=s728-e1000,2022-03-08 12:11:29.000000,2022-03-21 16:48:14.500199
nvidia,Motley Fool,newsfeedback@fool.com (Rich Smith),"Why Nvidia, Micron, and AMD Stocks Popped Tuesday",More worries over semiconductor shortages spark a relief rally today.,"What happened

Semiconductor stocks, which have been under pressure the past several days, bounced back in a big way Tuesday afternoon.

As of 1:15 p.m. ET, shares of Nvidia( NVDA 2.71% ) are up 4.3%… [+2650 chars]",https://www.fool.com/investing/2022/03/08/why-nvidia-micron-and-amd-stocks-popped-tuesday/,https://g.foolcdn.com/editorial/images/669557/red-and-blue-3d-semiconductor-computer-chip.jpg,2022-03-08 19:54:05.000000,2022-03-21 16:48:14.500199
nvidia,The Next Web,Napier Lopez,Everything Apple announced at its March 8 event,"Apple just held its first event of 2022, and as expected, it was jam packed with announcements — some of them predicted, and some of them genuine surprises. Didn’t have time to watch the event yourself? Here’s what you need to know. The new iPhone SE Apple ha…","Apple just held its first event of 2022, and as expected, it was jam-packed with announcements some of them predicted, and some of them genuine surprises.

Didnt have time to watch the event yourself… [+5079 chars]",https://thenextweb.com/news/apple-event-march-8-2022,https://img-cdn.tnwcdn.com/image/plugged?filter_last=1&fit=1280%2C640&url=https%3A%2F%2Fcdn0.tnwcdn.com%2Fwp-content%2Fblogs.dir%2F1%2Ffiles%2F2022%2F03%2FApple-event-copy.jpg&signature=4866fc717adf55fd2e24d12408ea29a6,2022-03-08 19:25:17.000000,2022-03-21 16:48:14.500199
nvidia,Windows Central,Sean Endicott,Almost 16% of Steam users run Windows 11 on their PC,"Almost one out of every six Steam users is running Windows 11 on their PC.







What you need to know





Usage of Windows 11 among Steam gamers increased to 15.59% in February 2022.

That increase marks a 2.03% growth of Windows 11 usage by Steam gamers since las…","Gaming enthusiasts are slowly adopting Windows 11, according to the latest Steam hardware and software survey. Windows 10 still dominates at 75.69%, but Windows 11 is steadily on the rise, reaching 1… [+1344 chars]",https://www.windowscentral.com/windows-11-continues-grow-use-among-steam-gamers-now-almost-16,https://www.windowscentral.com/sites/wpcentral.com/files/styles/large/public/field/image/2018/06/blade-15-steam.jpg,2022-03-08 13:56:15.000000,2022-03-21 16:48:14.500199
nvidia,Windows Central,Brendan Lowry,"Need a laptop with a backlit keyboard? These options won""t disappoint.","If you often find yourself working during nighttime hours or in dimly lit rooms, getting a keyboard that has good backlighting is crucial. This feature lights up your keycaps as you type, allowing you to easily see where specific keys are. Thankfully, keyboar…","If you often find yourself working during nighttime hours or in dimly lit rooms, getting a keyboard that has good backlighting is crucial. This feature lights up your keycaps as you type, allowing yo… [+5731 chars]",https://www.windowscentral.com/12-great-laptops-backlit-keyboards,https://www.windowscentral.com/sites/wpcentral.com/files/styles/large/public/field/image/2020/04/dell-xps-13-9300-1.jpg,2022-03-08 13:00:01.000000,2022-03-21 16:48:14.500199
nvidia,Motley Fool,newsfeedback@fool.com (Harsh Chauhan),"1 Massive Reason Nvidia""s Tearing Growth Will Continue",The graphics card specialist continues to dominate this lucrative market.,"The lucrative market for discrete graphics cards, used by video gamers in personal computers (PCs) and laptops, has played a crucial role in the terrific growth of Nvidia (NASDAQ:NVDA) over the years… [+4601 chars]",https://www.fool.com/investing/2022/03/08/1-massive-reason-why-nvidia-tearing-growth-will-c/,https://g.foolcdn.com/editorial/images/669320/man-woman-computer-screen.jpg,2022-03-08 12:21:00.000000,2022-03-21 16:48:14.500199
nvidia,Forbes,"Davey Winder, Senior Contributor, 

 Davey Winder, Senior Contributor

 https://www.forbes.com/sites/daveywinder/",Samsung Confirms Massive Galaxy Hack After 190GB Data Torrent Shared Via Telegram,"The NVIDIA hackers have now targeted Samsung. Here""s what Galaxy smartphone owners need to know.","Samsung confirms massive data breach

NurPhoto via Getty Images

The bad news is that Samsung has now confirmed that a criminal group has, indeed, succeeded in breaching security and stolen code that… [+4939 chars]",https://www.forbes.com/sites/daveywinder/2022/03/08/samsung-confirms-massive-galaxy-hack-after-190gb-data-torrent-shared-via-telegram/,https://imageio.forbes.com/specials-images/imageserve/1190727787/0x0.jpg?format=jpg&width=1200&fit=bounds,2022-03-08 09:50:45.000000,2022-03-21 16:48:14.500199
nvidia,Ubergizmo,Tyler Lee,Malware Is Disguising Itself As NVIDIA GPU Drivers,"Not too long ago, it was reported that NVIDIA had suffered a data breach in which quite a bit of data was stolen in the process. Among that stolen data are code-signing certificates. For those who don’t think it’s a big deal, it is because now it appears that…","Not too long ago, it was reported that NVIDIA had suffered a data breach in which quite a bit of data was stolen in the process. Among that stolen data are code-signing certificates. For those who do… [+1411 chars]",https://www.ubergizmo.com/2022/03/nvidia-gpu-driver-malware/,https://i0.wp.com/cdnssl.ubergizmo.com/wp-content/uploads/2019/10/hack-4.jpg,2022-03-08 08:41:35.000000,2022-03-21 16:48:14.500199
nvidia,GSMArena.com,Prasad,Apple announces M1 Ultra with 20-core CPU and 64-core GPU,"Apple today announced the M1 Ultra, its most powerful ARM-based custom processor designed for its new Mac Studio desktop computer.











The M1 Ultra is essentially two M1 Max chips connected together with a new interconnect architecture that Apple calls Ultra…","Apple today announced the M1 Ultra, its most powerful ARM-based custom processor designed for its new Mac Studio desktop computer.

The M1 Ultra is essentially two M1 Max chips connected together wit… [+1974 chars]",https://www.gsmarena.com/apple_announces_m1_ultra_with_20core_cpu_and_64core_gpu-news-53481.php,https://fdn.gsmarena.com/imgroot/news/22/03/m1-ultra/-952x498w6/gsmarena_000.jpg,2022-03-08 20:12:02.000000,2022-03-21 16:48:14.500199
nvidia,ExtremeTech,Josh Norem,"Rumor: Nvidia’s Next-Gen GPUs to Top Out at 600W, Possibly with GDDR7 Memory","Nvidia""s next-generation GPUs could top out at 600W and feature GDDR7 memory. While the power rumors are all over the place, all of them are high. 

The post Rumor: Nvidia’s Next-Gen GPUs to Top Out at 600W, Possibly with GDDR7 Memory appeared first on Extreme…","The latest leaks on the video card front contain a mix of good news, and the usual bad news. The good news is that it doesn’t look like Nvidia’s upcoming Lovelace GPUs will be the 850W nuclear reacto… [+4385 chars]",https://www.extremetech.com/gaming/332495-rumor-nvidias-next-gen-gpus-to-top-out-at-600w-possibly-with-gddr7-memory,https://www.extremetech.com/wp-content/uploads/2022/03/nvidia-ces-2022-geforce-rtx-3090-ti-large-3840-640x360.png,2022-03-08 20:30:55.000000,2022-03-21 16:48:14.500199
nvidia,TechRadar,Darren Allan,GPU prices sink to lowest levels in over a year,"Of course, they are still a good chunk above MSRP, but there is cause for optimism about the future.","Graphics card pricing is on a downward trend, and looks like it might be normalizing somewhat, with price tags tentatively edging back towards recommended levels – with some caveats as you might expe… [+2335 chars]",https://www.techradar.com/news/gpu-prices-sink-to-lowest-levels-in-over-a-year,https://cdn.mos.cms.futurecdn.net/gkrPzGSC3Yn9zTUAUvmGRe-1200-80.jpg,2022-03-08 11:57:41.000000,2022-03-21 16:48:14.500199
nvidia,PC Gamer,Hope Corrigan,Nvidia may sell 3000 series GPUs alongside next gen,I guess we may all finally have a chance to get a 3000 card.,The great chip shortage combined with crypto mining demands has been a heavy hit for graphics cards over the past few years. Getting a decent one over the past few years has been basically impossible… [+2276 chars],https://www.pcgamer.com/nvidia-may-sell-3000-series-gpus-alongside-next-gen/,https://cdn.mos.cms.futurecdn.net/s4DTScHjRoenBSj3e8FdQK-1200-80.jpg,2022-03-08 04:39:12.000000,2022-03-21 16:48:14.500199
nvidia,Motley Fool,"newsfeedback@fool.com (Trevor Jennewine, Billy Duberstein, Will Healy, and Jose Najarro)",5 Stocks to Get Your Feet Wet in Emerging AI,Artificial intelligence powers everything from robots to insurance companies.,"Artificial intelligence (AI) is more than a passing fad. But with an influence on such a broad range of industries, where should investors who are new to the space look first?

In this video clip fro… [+3505 chars]",https://www.fool.com/investing/2022/03/08/5-stocks-to-get-your-feet-wet-in-emerging-ai/,https://g.foolcdn.com/editorial/images/669559/gettyimages-artificialintelligence.jpg,2022-03-08 19:12:52.000000,2022-03-21 16:48:14.500199
nvidia,AnandTech,Ryan Smith,Apple Announces M1 Ultra: Combining Two M1 Maxes For Workstation Performance,"As part of Apple’s spring “Peek Performance” product event this morning, Apple unveiled the fourth and final member of the M1 family of Apple Silicon SoCs, the M1 Ultra. Aimed squarely at desktops – specifically, Apple’s new Mac Studio – the M1 Ultra finds Ap…","As part of Apple’s spring “Peek Performance” product event this morning, Apple unveiled the fourth and final member of the M1 family of Apple Silicon SoCs, the M1 Ultra. Aimed squarely at desktops – … [+13533 chars]",https://www.anandtech.com/show/17306/apple-announces-m1-ultra-combining-two-m1-maxes-for-even-more-performance,https://images.anandtech.com/doci/17306/Apple-M1-Ultra-hero-220308_678x452.jpg,2022-03-08 22:00:00.000000,2022-03-21 16:48:14.500199
nvidia,TechRadar,Sead Fadilpašić,"Samsung confirms cyberattack, says internal data leaked","Some ""source code” for Samsung Galaxy devices taken, company confirms.","Samsung has confirmed it has been hit by a data breach, but said no employee or customer data was impacted.

The Lapsus$ cybercrime gang recently published a 190GB-heavy data dump of intel allegedly … [+2332 chars]",https://www.techradar.com/news/samsung-hacked-galaxy-phones-leaked,https://cdn.mos.cms.futurecdn.net/SW6q5MsJ5EdSsCSg7uLxn6-1200-80.jpg,2022-03-08 12:30:14.000000,2022-03-21 16:48:14.500199
nvidia,Engadget,Igor Bonifacic,"Ubisoft says no user information was exposed in recent ""cyber security incident""","South American hacking group Lapsus$ is claiming responsibility for another high-profile hack. On Thursday, Ubisoft said

 it underwent a “cyber security incident” last week that saw some of its games, systems and services temporarily disrupted. At the time, …","South American hacking group Lapsus$ is claiming responsibility for another high-profile hack. On Thursday, Ubisoft said

 it underwent a cyber security incident last week that saw some of its games,… [+1047 chars]",https://www.engadget.com/ubisoft-cyber-security-incident-lapsus-claims-credit-164942979.html,https://s.yimg.com/os/creatr-uploaded-images/2022-03/880bc2f0-a223-11ec-99de-3cb2a0d7e0b9,2022-03-12 16:49:42.000000,2022-03-21 16:48:14.545857
nvidia,Android Police,Steve Huff,Nvidia and Samsung hackers take credit for Ubisoft attack,The game company says no personal info was exposed,"Ubisoft may be the latest victim in a cybercrime spree that has already affected chipmaker Nvidia and South Korean electronics giant Samsung. As a result, the company had to take measures to reassure… [+1916 chars]",https://www.androidpolice.com/nvidia-and-samsung-hackers-take-credit-for-ubisoft-attack/,https://static1.anpoimages.com/wordpress/wp-content/uploads/2020/10/27/Ubisoft__Rebranding.jpg.jpg,2022-03-12 21:47:20.000000,2022-03-21 16:48:14.545857
nvidia,Slashdot.org,EditorDavid,How China Built an Exascale Supercomputer Out of Old 14nm Tech,"Slashdot reader katydid77 shares a report from the supercomputing site The Next Platform:

If you need any proof that it doesn""t take the most advanced chip manufacturing processes to create an exascale-class supercomputer, you need look no further than the Su…","If you need any proof that it doesn""t take the most advanced chip manufacturing processes to create an exascale-class supercomputer, you need look no further than the Sunway ""OceanLight"" system house… [+2757 chars]",https://tech.slashdot.org/story/22/03/12/1843220/how-china-built-an-exascale-supercomputer-out-of-old-14nm-tech,https://a.fsdn.com/sd/topics/china_64.png,2022-03-12 20:34:00.000000,2022-03-21 16:48:14.545857
nvidia,Motley Fool,newsfeedback@fool.com (Brett Schafer),Wall Street Loves These 3 Growth Stocks -- Should You?,"Tesla, Nvidia, and Apple are investing favorites on Wall Street. But do they belong in your portfolio?","If you are an individual investor, it can be helpful to check what sentiment is from the big dogs on Wall Street from time to time. Luckily, tons of Wall Street analysts post their research publicly,… [+4629 chars]",https://www.fool.com/investing/2022/03/12/wall-street-loves-these-3-growth-stocks-should-you/,https://g.foolcdn.com/editorial/images/669932/thinking.jpg,2022-03-12 12:10:00.000000,2022-03-21 16:48:14.545857
nvidia,Forbes,"Davey Winder, Senior Contributor, 

 Davey Winder, Senior Contributor

 https://www.forbes.com/sites/daveywinder/",Threat Intel Report: Who Is Behind Staggering 190GB Samsung Galaxy Hack?,Who are the cybercriminals behind the massive NVIDIA and Samsung hack attacks?,Earlier this week I reported that Samsung had confirmed a data breach involving a criminal group that appears to have made off with some 190GB of code involving the flagship Galaxy series of smartpho… [+11567 chars],https://www.forbes.com/sites/daveywinder/2022/03/12/threat-intel-report-who-is-behind-staggering-190gb-samsung-galaxy-hack/,"https://imageio.forbes.com/specials-images/imageserve/622b25b761a15839b66f32c7/0x0.jpg?format=jpg&crop=3403,1913,x0,y106,safe&fit=crop",2022-03-12 13:00:00.000000,2022-03-21 16:48:14.545857
nvidia,Motley Fool,newsfeedback@fool.com (Keithen Drury),3 Top Artificial Intelligence Stocks to Buy in March,"Not just a buzzword, artificial intelligence is instrumental in the offerings of these companies.","Artificial intelligence (AI) is often used as a buzzword when companies are trying to sell their product. They often have some form of AI, but it really isn""t as much of a game-changer as it is hyped… [+5343 chars]",https://www.fool.com/investing/2022/03/12/3-top-artificial-intelligence-stocks-to-buy-in-mar/,https://g.foolcdn.com/editorial/images/669107/man-looking-at-an-ai-dashboard.jpg,2022-03-12 11:00:00.000000,2022-03-21 16:48:14.545857
nvidia,Neowin,sen92sayan@gmail.com (Sayan Sen),Nvidia next-gen Ada rumors run wild as RTX 4090 rumored to gobble 600W power all by itself,"Nvidia""s next-gen RTX 4090, based on the Ada Lovelace architecture, is rumored to feature an insane 600W TGP according to recent reports, a massive jump up from what Nvidia currently has. Read more...","GeForce RTX 30 series

Power consumption rumors surrounding Nvidia""s next-gen Ada Lovelace GPU architecture - the one that""s going to succeed the current Ampere-based RTX 3000 series - have struck, a… [+1269 chars]",https://www.neowin.net/news/nvidia-next-gen-ada-rumors-run-wild-as-rtx-4090-rumored-to-gobble-600w-power-all-by-itself/,https://cdn.neow.in/news/images/uploaded/2020/10/1601931739_geforce-rtx-30-series_story.jpg,2022-03-12 13:34:01.000000,2022-03-21 16:48:14.545857
nvidia,Techviral.net,Farhan Shaikh,Nvidia GeForce RTX 4090 Graphics Card Leaked Online,"Nvidia’s next flagship GPU, RTX 4090, details have been leaked online. According to the latest rumors, the RTX 4090 GPU might come with faster GDRR7 memory. A YouTube channel, Moore’s Law Is Dead (MLID), the upcoming RTX 4090 GPU with AD102 chip might be the …","Nvidias next flagship GPU, RTX 4090, details have been leaked online. According to the latest rumors, the RTX 4090 GPU might come with faster GDRR7 memory.

A YouTube channel, Moores Law Is Dead (MLI… [+1608 chars]",https://techviral.net/nvidia-geforce-rtx-4090-graphics-card/,https://techviral.net/wp-content/uploads/2022/03/RTX-4090-Might-Twice-As-Fast-As-RTX-3090.jpg,2022-03-12 18:37:30.000000,2022-03-21 16:48:14.545857
nvidia,XDA Developers,Rich Woods,"HP Spectre x360 16 review: It’s a lot of computer, but it’s awesome","If you’re looking for a big-screen convertible, the HP Spectre x360 16 is hands down your best option. And I’m not just saying that because big-screen convertibles are incredibly rare. Indeed, Dell made an XPS 15 2-in-1 once…once. With this year’s Spectre x36…","If you’re looking for a big-screen convertible, the HP Spectre x360 16 is hands down your best option. And I’m not just saying that because big-screen convertibles are incredibly rare. Indeed, Dell m… [+14046 chars]",https://www.xda-developers.com/hp-spectre-x360-16-review/,https://www.xda-developers.com/files/2022/02/HP-Spectre-x360-16-1.jpg,2022-03-12 16:00:51.000000,2022-03-21 16:48:14.545857
nvidia,Creative Bloq,jessica.weatherbed@futurenet.com (Jess Weatherbed),The best laptops for battery life in {year},Our pick of the best laptops for battery life for creative professionals and students.,"The best laptops for battery life are becoming more important than ever due to the rise in hybrid working and education. At one moment, you could be working at home or in a studio or lecture hall, an… [+8424 chars]",https://www.creativebloq.com/buying-guides/best-laptops-for-battery-life,https://cdn.mos.cms.futurecdn.net/N3YD5FGp5sRFwwgaUMQh6H-1200-80.jpg,2022-03-12 13:18:57.000000,2022-03-21 16:48:14.545857
nvidia,Motley Fool,newsfeedback@fool.com (Rich Duprey),2 Dividend-Paying Tech Stocks to Buy in March,Investors should stand ready to take advantage of these fast-growing tech stocks.,"Inflation is running higher than it has in 40 years, national average gas prices just broke through to record highs, and Russia""s invasion of Ukraine is roiling commodities markets.

Couple all this … [+4883 chars]",https://www.fool.com/investing/2022/03/12/2-dividend-paying-tech-stocks-to-buy-in-march/,https://g.foolcdn.com/editorial/images/669544/mobile-smartphone-video-chat-text-getty.jpeg,2022-03-12 11:32:00.000000,2022-03-21 16:48:14.545857
